User,Handle,PostDate,TweetText,ReplyCount,RetweetCount,LikeCount
TimBukOne,@TimBukOne,2024-03-30T06:04:12.000Z,"TimBukOne
@TimBukOne
Â·
Mar 30#JSE Trading Stats - 28/03/2024 - #SACorporateRealEstate #Naspers #BHPGroup #RedefineProperties #AngloAmerican #AnheuserBusch",1,,
Jesica,@mizuhof,2024-03-30T01:42:31.000Z,"Jesica
@mizuhof
Â·
Mar 30Replying to 
@mizuhof",1,,1
SteelRadar,@steelradar,2024-03-29T11:21:48.000Z,"SteelRadar
@steelradar
Â·
Mar 29China's young steel industry complicates net zero target
Mike Henry, CEO of BHP Group Ltd, states that China's steel industry is younger compared to Europe and therefore follows a different strategy to achieve decarbonization targets. This shows that China may be at aâ€¦
Show more",,,
TimBukOne,@TimBukOne,2024-03-29T06:01:13.000Z,"TimBukOne
@TimBukOne
Â·
Mar 29#JSE Trading Stats - 28/03/2024 - #SACorporateRealEstate #Naspers #BHPGroup #RedefineProperties #AngloAmerican #AnheuserBusch",,,
Kaiser Wilhelm I. 1871,@KWilhelm1871,2024-03-28T21:27:18.000Z,"Kaiser Wilhelm I. 1871
@KWilhelm1871
Â·
Mar 28Replying to 
@Finanzdani",1,,2
NAI500,@NAI500,2024-03-28T18:30:27.000Z,"NAI500
@NAI500
Â·
Mar 28[å…¨çƒå‰äº”å¤§ #é“œ å‚¨é‡å›½ï¼ˆ2024å¹´æ›´æ–°ï¼‰]

BHP Group Ltd. $BHP
Southern Copper Corp $SCCO
Zijin Mining Group $ZIJMY

æ·±å…¥äº†è§£ï¼šhttps://ow.ly/OjQP50R4kU3

#cleanenergy #gold #copper",,,
TimBukOne,@TimBukOne,2024-03-28T06:03:14.000Z,"TimBukOne
@TimBukOne
Â·
Mar 28#JSE Trading Stats - 26/03/2024 - #Firstrand #Naspers #BHPGroup #SibanyeStillwater #AnheuserBusch",1,,
Leyla Turut,@leylasborsa1,2024-03-28T02:22:32.000Z,"Leyla Turut
@leylasborsa1
Â·
Mar 28Replying to 
@leylasborsa1",1,,9
CommSec,@CommSec,2024-03-28T01:25:35.000Z,"CommSec
@CommSec
Â·
Mar 28In Sydney, mining stocks gained as much 2.1%, hitting their highest level since March 5. Heavyweights Rio Tinto $RIO, Fortescue $FMG and BHP Group $BHP climbed between 1.5% and 1.8%.",,2,2
CommSec,@CommSec,2024-03-27T20:21:55.000Z,"CommSec
@CommSec
Â·
Mar 27On Thursday, several ASX 200 listed companies pay their latest dividends to investors, including BHP Group $BHP, Commonwealth Bank of Australia $CBA and Telstra Group $TLS.",,1,5
TimBukOne,@TimBukOne,2024-03-27T06:01:15.000Z,"TimBukOne
@TimBukOne
Â·
Mar 27#JSE Trading Stats - 26/03/2024 - #Firstrand #Naspers #BHPGroup #SibanyeStillwater #AnheuserBusch",,1,
CommSec,@CommSec,2024-03-27T00:11:01.000Z,"CommSec
@CommSec
Â·
Mar 27Australian mining stocks slide as much as 0.9% to their lowest level since March 19 on soft iron ore prices. Shares of top miners BHP Group $BHP and Rio Tinto $RIO fall as much as 1.2% and 2.2%, respectively.",1,1,1
TimBukOne,@TimBukOne,2024-03-26T06:04:13.000Z,"TimBukOne
@TimBukOne
Â·
Mar 26#JSE Trading Stats - 25/03/2024 - #Firstrand #Naspers #BHPGroup #RedefineProperties #AnheuserBusch",,1,
John,@PlasteredJohn,2024-03-25T22:14:53.000Z,"John
@PlasteredJohn
Â·
Mar 25Rising Copper Prices, Portfolio Review Make Underperforming Anglo American Stock A Potential Bargain: Report - Glencore  ( OTC:GLNCY ) , BHP Group  ( NYSE:BHP )",,,
CommSec,@CommSec,2024-03-25T01:05:26.000Z,"CommSec
@CommSec
Â·
Mar 25Fortescue $FMG gained as much as 5.2% to touch its highest level since March 8. Shares of Rio Tinto $RIO and BHP Group $BHP gained as much as 1.4% and 1.1%, respectively.",,2,5
CommSec,@CommSec,2024-03-25T00:53:23.000Z,"CommSec
@CommSec
Â·
Mar 25Here are the most traded stocks by CommSec clients last week. $BHP Group has retained the top spot.

#ASX #ASX200",,3,4
Kalkine Media Australia,@kalkineau,2024-03-24T07:30:00.000Z,"Kalkine Media Australia
@kalkineau
Â·
Mar 24With a median #pricetoearnings (P/E) ratio of approximately 19x in Australia, one might not find #BHPGroup Limited's (ASX:BHP) P/E ratio of 19.1x particularly remarkable. Here's what you need to know.
#stockperformance #ASX #PERatio",,,
John,@PlasteredJohn,2024-03-23T16:19:55.000Z,"John
@PlasteredJohn
Â·
Mar 23Global Mining Industry Faces 'Trust Deficit' Despite Being Asked To Produce More Metals For Energy Transition - Albemarle  ( NYSE:ALB ) , BHP Group  ( NYSE:BHP )",,,
Bergfahrten î¨€,@bergfahrten,2024-03-23T11:35:26.000Z,"Bergfahrten î¨€
@bergfahrten
Â·
Mar 23Re-check Dividenden:
2022 BHP Group inkl. Sonderdividende und
3M mit QuartalsausschÃ¼ttung p.a. > 1 TEUR",1,,17
TimBukOne,@TimBukOne,2024-03-21T06:02:13.000Z,"TimBukOne
@TimBukOne
Â·
Mar 21#JSE Trading Stats - 20/03/2024 - #OldMutual #Naspers #BHPGroup #Growthpoint #Prosus #AnheuserBusch",,1,
hasanak vazer,@Hasanak_Vazer,2024-03-21T04:42:12.000Z,"hasanak vazer
@Hasanak_Vazer
Â·
Mar 21Replying to 
@Ehsanviews1",,,
CommSec,@CommSec,2024-03-21T01:26:13.000Z,"CommSec
@CommSec
Â·
Mar 21Miners rose 0.7% as iron ore futures extended gains for a third straight session on hopes of better demand from China. Mining behemoths BHP Group $BHP, Rio Tinto $RIO and Fortescue $FMG were all trading in the green.",,1,
DividendValueBuilder,@KenFaulkenberry,2024-03-21T00:02:46.000Z,"DividendValueBuilder
@KenFaulkenberry
Â·
Mar 21Top Basic Materials stocks Within Each Dividend Value Builder Risk/Stability Grades:

Symbol - Company Name (Risk/Stability Grade) - Yield
None (A)
$LIN - Linde PLC (B) - 1.2%
$RIO - Tinto PLC ADR (C) - 7.0%
$BHP - BHP Group (C) - 5.3%
$VALE - Vale ADR (D) - 14.2%
$NTR - Nutrienâ€¦
Show more",1,2,5
TechSignals,@techsignalsbot,2024-03-20T13:45:24.000Z,"TechSignals
@techsignalsbot
Â·
Mar 20Replying to 
@techsignalsbot",,,
TRADINGLOUNGE,@TradingLounge,2024-03-20T06:08:38.000Z,"TRADINGLOUNGE
@TradingLounge
Â·
Mar 20ASX: BHP GROUP LIMITED - BHP (1D Chart)
Details: The short-term outlook differs from the broader context, suggesting that BHP may rise higher before resuming its downward trajectory.

Analyst: Hua (Shane) Cuong
http://Tradinglounge.com
#BHPGroup #elliottwave #asx #analysis",1,1,
TimBukOne,@TimBukOne,2024-03-20T06:02:19.000Z,"TimBukOne
@TimBukOne
Â·
Mar 20#JSE Trading Stats - 19/03/2024 - #SibanyeStillwater #Naspers #BHPGroup #PremierGroup #Richemont #AnheuserBusch",1,,
CommSec,@CommSec,2024-03-20T01:45:22.000Z,"CommSec
@CommSec
Â·
Mar 20Miners edged 0.1% higher, with iron prices to a near one-week high. BHP Group $BHP, Rio Tinto $RIO and Fortescue $FMG rose 0.4%, 0.6% and 1.3%, respectively.",,1,12
ZoomStocks Markets,@ZSMarkets,2024-03-19T07:18:17.000Z,"ZoomStocks Markets
@ZSMarkets
Â·
Mar 19#Australia: Stocks: Movers & Shakers

âœ¦IT stocks gain as #AUCloud raises capital

#WisetecGlobal â–²0.7%, #ReaGroup â–²1.2%

âœ¦Mining stocks emerge as top gainers

#BHPGroup â–²2.8%, #RioTinto â–²2.5%
Show more",1,1,
TimBukOne,@TimBukOne,2024-03-19T06:04:18.000Z,"TimBukOne
@TimBukOne
Â·
Mar 19#JSE Trading Stats - 18/03/2024 - #RedefineProperties #Naspers #BHPGroup #SibanyeStillwater #AngloAmerican #AnheuserBusch",1,,
CommSec,@CommSec,2024-03-19T01:11:26.000Z,"CommSec
@CommSec
Â·
Mar 19Miners led gains, rising 0.5%, as iron prices rebounded on positive data from top consumer China. Mining giants BHP Group $BHP, Rio Tinto $RIO and Fortescue $FMG climbed between 0.7% and 0.8%.",,1,2
CommSec,@CommSec,2024-03-18T01:35:37.000Z,"CommSec
@CommSec
Â·
Mar 18BHP Group $BHP sees that 30% of Australian nickel mines have been closed with 30% more under pressure because of low prices, outgoing Chief Financial Officer David Lamont said on Monday.",,5,14
Day Trading Academy,@DTradingAcademy,2024-03-18T01:13:27.000Z,"Day Trading Academy
@DTradingAcademy
Â·
Mar 18The worldâ€™s largest miner BHP Group LTD, has taken a 25% of its workers constructing its West Musgrave copper & nickel project in Western Australia, according to a report from the Australian Financial Review. The workforce at the A$1.7B project has been cut from about 400 to 300",2,,
CommSec,@CommSec,2024-03-18T01:11:45.000Z,"CommSec
@CommSec
Â·
Mar 18BHP Group $BHP and Fortescue $FMG declined 0.2% and 1.6%, respectively, while Rio Tinto $RIO edged 0.2% higher. Mineral Resources $MIN rose as much as 0.9% after the company said it would develop a lithium processing hub in Western Australia.",,1,4
Australasian Centre for Corporate Responsibility,@AustCCR,2024-03-17T23:26:30.000Z,"Australasian Centre for Corporate Responsibility
@AustCCR
Â·
Mar 18BHP Group Ltd., the worldâ€™s largest miner, has stood down around a quarter of the workers constructing its West Musgrave nickel and copper project in Western Australia, according to a report from the Australian Financial Review.",,1,3
Venture Investment Partners (VIP),@GeorgeB14941177,2024-03-17T17:55:10.000Z,"Venture Investment Partners (VIP)
@GeorgeB14941177
Â·
Mar 17#Sunday is for #dividends 
With this massive #tech & #StockMarket  rally, here's a few less glamorous #stocks with nice #dividend yields.
$KHC Kraft Heinz 4.66%
$AMGN Amgen 3.35%
$BHP BHP Group 8.69%
$RIO Rio Tinto 10.61%
$MO Altria 8.94&
$BTI BAT 9.85%
$ARCC Ares Cap 9.51%",4,,5
Giovanni Staunovo,@staunovo,2024-03-17T10:26:23.000Z,"Giovanni Staunovo
@staunovo
Â·
Mar 17BHP Group Ltd., the worldâ€™s largest miner, has stood down around a quarter of the workers constructing its West Musgrave nickel and copper project in Western Australia, according to a report from the Australian Financial Review.

The workforce at the A$1.7 billion project hasâ€¦
Show more",2,4,20
squil,@breadonbread2,2024-03-16T23:21:44.000Z,"squil
@breadonbread2
Â·
Mar 17Bitch think she BHP Group the way she drilling my southern hemisphere",,,
Investing.com Polska,@InvestingPoland,2024-03-16T08:52:05.000Z,"Investing.com Polska
@InvestingPoland
Â·
Mar 16Macquarie utrzymuje rekomendacjÄ™ dla BHP Group Ltd na 'neutralnie'  z cenÄ… docelowÄ… akcji na poziomie ... - https://invst.ly/140awk",,,
Investing.com Polska,@InvestingPoland,2024-03-16T08:52:05.000Z,"Investing.com Polska
@InvestingPoland
Â·
Mar 16Macquarie utrzymuje rekomendacjÄ™ dla BHP Group PLC na 'neutralnie'  z cenÄ… docelowÄ… akcji na poziomie ... - https://invst.ly/140awj",,,
TimBukOne,@TimBukOne,2024-03-16T06:03:36.000Z,"TimBukOne
@TimBukOne
Â·
Mar 16#JSE Trading Stats - 15/03/2024 - #SibanyeStillwater #AngloAmerican #BHPGroup #OldMutual #Naspers #AnheuserBusch",,,
Traders Union,@TradersUnion_TU,2024-03-15T15:12:45.000Z,"Traders Union
@TradersUnion_TU
Â·
Mar 15 TOP URANIUM STOCKS TO BUY IN 2024 

 https://tradersunion.com/interesting-articles/best-stocks-to-buy-now/top-uranium-stocks/â€¦

 Top 7 #uraniumstocks to buy:
 Uranium Energy Corp (#UEC)
 Cameco (#CCJ)
 Energy Fuels (#UUUU)
 Uranium Royalty Corp (#UROY)
 NuScale Power Corporation (#SMR)
Show more",,,2
ZoomStocks Markets,@ZSMarkets,2024-03-15T14:02:59.000Z,"ZoomStocks Markets
@ZSMarkets
Â·
Mar 15#Europe: Stocks: Movers & Shakers

#UK

âœ¦Mining stocks slump as RBC Capital Market analysts give update on #Glencore

#BHPGroup 1.7%, #RioTinto 0.4%

âœ¦Food stocks lead amongst the sectors
Show more",3,1,
Kalkine Media Australia,@kalkineau,2024-03-15T09:05:00.000Z,"Kalkine Media Australia
@kalkineau
Â·
Mar 15#BHPGroup (ASX: BHP), the global #miningpowerhouse, experienced a significant uptick in its #stockprice, climbing as much as 2.65% in a day.",,,
Hilary Katz,@hilary_katz,2024-03-14T14:03:53.000Z,"Hilary Katz
@hilary_katz
Â·
Mar 14BHP Group 52726 very oversold can rally to 55000 for traders",,1,7
Gamesitas trader,@gamesitas15e,2024-03-14T11:13:12.000Z,"Gamesitas trader
@gamesitas15e
Â·
Mar 14Believe: JP Morgan mantiene su recomendaciÃ³n de neutral y eleva su precio objetivo de 11,60 a 15 euros.
BHP Group: Citigroup cambia su recomendaciÃ³n de neutral a comprar.

Carl Zeiss Meditec Ag: RBC Capital eleva su calificaciÃ³n a sobresaliente con un precio objetivo de 150 EUR.",1,,
BROKSTOCK,@brokstock,2024-03-14T08:29:35.000Z,"BROKSTOCK
@brokstock
Â·
Mar 14Good morning, investors!
Here's a portion of this morning's TOP 5 JSE Winners & Losers

WINNERS
South32 Limited 3.02%
Bhp Group Limited 1.39%
Absa Group Limited 0.97%
Nepi Rockcastle Plc 0.72%
Capitec 0.61%
Show more",,,
TimBukOne,@TimBukOne,2024-03-14T06:04:38.000Z,"TimBukOne
@TimBukOne
Â·
Mar 14#JSE Trading Stats - 13/03/2024 - #BraitSE #Naspers #BHPGroup #SibanyeStillwater #AngloAmerican #AnheuserBusch",1,1,
Pico Global,@PicoGlobal,2024-03-14T04:53:58.000Z,"Pico Global
@PicoGlobal
Â·
Mar 14Replying to 
@PicoGlobal",1,,2
CommSec,@CommSec,2024-03-14T01:15:04.000Z,"CommSec
@CommSec
Â·
Mar 14Miners .AXMM, however, capped losses, rising as much as 2.1%, their biggest intraday climb since March 1. Mining giants BHP Group $BHP and Rio Tinto $RIO jumped 2.5% and 1.5%, respectively.",1,,1
TimBukOne Candlesticks,@TimBukOneCandle,2024-03-13T22:12:35.000Z,"TimBukOne Candlesticks
@TimBukOneCandle
Â·
Mar 13#BHPGroup $JSEBHG - Search: http://dlvr.it/T42JHS",,,1
Luke Turner,@Luketurrner,2024-03-13T18:22:19.000Z,"Luke Turner
@Luketurrner
Â·
Mar 13ASX: $CBE

Cobre is working with BHP Group, one of the world's largest miners, to explore the Kalahari Copper Belt.

Major collaboration 

#RenewableEnergy $CBE #Mining #Exploration #Botswana #Copper #Silver #StockMarket #Investing $NIM $WIA $EVN $BHP $FMG $MIN $RIO $CBE",2,12,12
buysellsignals,@selltipsdotcom,2024-03-13T14:58:17.000Z,"buysellsignals
@selltipsdotcom
Â·
Mar 13BHP Group (BHP: GBX2,193.50) drops GBX11.50 on slipping relative strength; -GBX11.50 [-0.5%] Vol Index 1.1 [1 is avg]",,,
buysellsignals,@selltipsdotcom,2024-03-13T14:06:47.000Z,"buysellsignals
@selltipsdotcom
Â·
Mar 13BHP Group (BHP: GBX2,188.50) drops to seven-month low; -GBX16.50 [-0.7%]",,,
Rosa Cunha,@Conservadora191,2024-03-13T12:56:46.000Z,"Rosa Cunha
@Conservadora191
Â·
Mar 13Replying to 
@Conservadora191",1,,
ZoomStocks Markets,@ZSMarkets,2024-03-13T07:21:21.000Z,"ZoomStocks Markets
@ZSMarkets
Â·
Mar 13#Australia: Stocks: Movers & Shakers

âœ¦Metals stocks trade mixed as #SyrahResources looks to raise capital

#BHPGroup 1.3%, #RioTinto â–²1.4%

âœ¦REITs lead the gains amongst the sectors

#GoodmanGroup â–²2.5%, #VicinityCentres â–²1.4%
Show more",,1,
TimBukOne,@TimBukOne,2024-03-13T06:03:38.000Z,"TimBukOne
@TimBukOne
Â·
Mar 13#JSE Trading Stats - 12/03/2024 - #MASRealEstate #Naspers #BHPGroup #RedefineProperties #BritishAmericanTobacco #AnheuserBusch",,,
æ¨ªç”° æ·³,@fitzsimmons151,2024-03-13T02:55:26.000Z,"æ¨ªç”° æ·³
@fitzsimmons151
Â·
Mar 13BHP Group reported a profit exceeding expectations due to high iron ore prices on Tuesday.",,,
CommSec,@CommSec,2024-03-13T01:09:11.000Z,"CommSec
@CommSec
Â·
Mar 13Miners lost 0.6%, as iron ore prices extended declines. Mining behemoths BHP Group $BHP and Fortescue $FMG dropped 0.9% and 0.6%, respectively.",,1,2
Jack Straw,@JackStr42679640,2024-03-12T08:58:21.000Z,"Jack Straw
@JackStr42679640
Â·
Mar 12No Bailout For Chinese Real Estate Developers Spells Trouble For #IronOre Prices - Fortescue (OTC:FSUMF), BHP Group (NYSE:BHP) - Benzinga",1,5,8
TifaniesweTs,@TifaniesweTs,2024-03-12T07:39:35.000Z,"TifaniesweTs
@TifaniesweTs
Â·
Mar 12No Bailout For Chinese Real Estate Developers Spells Trouble For #IronOre Prices - Fortescue (OTC:FSUMF), BHP Group (NYSE:BHP) - Benzinga",,,
ZoomStocks Markets,@ZSMarkets,2024-03-12T07:07:22.000Z,"ZoomStocks Markets
@ZSMarkets
Â·
Mar 12#Australia: Stocks: Movers & Shakers

âœ¦Mining stocks slump as #GoldenStateMining gives exploration update

#BHPGroup 0.7%, #RioTinto 0.2%

âœ¦IT stocks emerge as top gaining sectors

#WisetechGlobal â–²1.8%, #ReaGroup â–²0.6%
Show more",2,1,1
TimBukOne,@TimBukOne,2024-03-12T06:01:38.000Z,"TimBukOne
@TimBukOne
Â·
Mar 12#JSE Trading Stats - 11/03/2024 - #Firstrand #Naspers #BHPGroup #FortressReit #ABSA #AnheuserBusch",,1,
CommSec,@CommSec,2024-03-11T22:54:38.000Z,"CommSec
@CommSec
Â·
Mar 11BHP Group $BHP, Rio Tinto $RIO and other steel-related shares may decline on Tuesday after iron ore slumped the most since mid-2022. Iron ore futures in Singapore plunged on Monday after disappointing demand in China left the market lumbered with swelling inventories.",1,3,3
buysellsignals,@selltipsdotcom,2024-03-11T15:33:03.000Z,"buysellsignals
@selltipsdotcom
Â·
Mar 11BHP Group (BHP: GBX2,185.0) keeps sliding; -GBX50.50 [-2.3%] Vol Index 2.1 [1 is avg]",,,
buysellsignals,@selltipsdotcom,2024-03-11T13:30:13.000Z,"buysellsignals
@selltipsdotcom
Â·
Mar 11BHP Group (BHP: GBX2,178.0) accelerates decline; -GBX57.50 [-2.6%]",,,
FintelAlerts,@FintelAlerts,2024-03-11T10:13:51.000Z,"FintelAlerts
@FintelAlerts
Â·
Mar 11$BHP / BHP Group Limited - Depositary Receipt () files form 6-K https://fintel.io/doc/sec-bhp-group-ltd-811809-6k-2024-march-11-19793-6251?utm_source=twitter.com&utm_medium=referral&utm_campaign=filingâ€¦",,,
TimBukOne Charts,@TimBukOneCharts,2024-03-11T07:14:35.000Z,"TimBukOne Charts
@TimBukOneCharts
Â·
Mar 11#BHPGroup $JSEBHG has issued a market related announcement: http://dlvr.it/T3vHKV",1,,
TimBukOne SENS,@TimBukOneSENS,2024-03-11T07:12:35.000Z,"TimBukOne SENS
@TimBukOneSENS
Â·
Mar 11#BHPGroup $JSEBHG - SENS PDF: http://dlvr.it/T3vH6t",,,
ZoomStocks Markets,@ZSMarkets,2024-03-11T07:02:33.000Z,"ZoomStocks Markets
@ZSMarkets
Â·
Mar 11#Australia: Stocks on the move today

âœ¦Investment Management stocks fall as #ACRFunds raises capital

#Macquarie 0.9%, #AustralianFoundation 1.9%

âœ¦Mining stocks emerge as top losers amongst the sectors

#BHPGroup 2.6%, #RioTinto 3.6%
Show more",2,1,
TimBukOne SENS,@TimBukOneSENS,2024-03-11T05:12:12.000Z,"TimBukOne SENS
@TimBukOneSENS
Â·
Mar 11#BHPGroup $JSEBHG - SENS PDF: http://dlvr.it/T3v6g4",,,
TimBukOne Charts,@TimBukOneCharts,2024-03-11T05:11:10.000Z,"TimBukOne Charts
@TimBukOneCharts
Â·
Mar 11#BHPGroup $JSEBHG has issued a market related announcement: http://dlvr.it/T3v6bq",,,
CommSec,@CommSec,2024-03-11T02:04:29.000Z,"CommSec
@CommSec
Â·
Mar 11The S&P/ASX 200 is down 1.4% at 7,735.40. Materials stocks led the market lower, as all sectors lost; 157 of 200 shares fell, while 39 rose. BHP Group $BHP contributed the most to the index decline, decreasing 2.4%. Champion Iron $CIA had the largest drop, falling 4.8%.",,1,7
TimBukOne,@TimBukOne,2024-03-07T06:00:39.000Z,"TimBukOne
@TimBukOne
Â·
Mar 7#JSE Trading Stats - 06/03/2024 - #RedefineProperties #Naspers #BHPGroup #Firstrand #AnheuserBusch",,,
CommSec,@CommSec,2024-03-07T03:12:32.000Z,"CommSec
@CommSec
Â·
Mar 7Shares of BHP Group $BHP and Rio Tinto $RIO fall more than 2% each as iron ore giants trade ex-dividend. Both are near their lowest levels since October-November 2023.",,,1
CommSec,@CommSec,2024-03-07T01:37:16.000Z,"CommSec
@CommSec
Â·
Mar 7Bucking the trend, miners fell 0.4%, as iron ore futures declined on a weak steel market and lack of stimulus from top consumer China. Miners BHP Group $BHP and Rio Tinto $RIO lose 1.3% and 2.5%, respectively, trading ex-dividend.",1,1,2
NAI500,@NAI500,2024-03-06T17:30:15.000Z,"NAI500
@NAI500
Â·
Mar 6[æœ€æ–°ï¼2023å¹´å…¨çƒåå¤§ #é“œ ç”Ÿäº§å›½]

BHP Group Ltd. $BHP
Southern Copper Corp $SCCO
Ivanhoe Mines $IVN

æ·±å…¥äº†è§£ï¼šhttps://ow.ly/TMjA50QMKJt

#basemetals #copper",,,
StockWatchWeekly,@SWatchWeeklyCom,2024-03-06T11:00:12.000Z,"StockWatchWeekly
@SWatchWeeklyCom
Â·
Mar 6 BHP Group Ltd recently announced a dividend of $1.44 per share, payable on 2024-03-28. Understand more about its dividend and financial health: https://gurufocus.com/news/2374658/bhp-group-ltds-dividend-analysisâ€¦ #StocksToWatch #StockMarket",,1,
Usa Jaun News,@UsaJaunNews,2024-03-06T10:14:46.000Z,"Usa Jaun News
@UsaJaunNews
Â·
Mar 6BHP Group Ltd's Dividend Analysis 
Understanding BHP Group Ltd's Upcoming ... Understanding BHP Group Ltdâ€™s Upcoming Dividend and Financial Health BHP Group Ltd (NYSE:BHP) recently announced a dividend of $1.44 per share, payable on 2024-03-28, with the...",,,
BROKSTOCK,@brokstock,2024-03-06T09:21:54.000Z,"BROKSTOCK
@brokstock
Â·
Mar 6Good morning, investors!
Here's a portion of this morning's TOP 5 JSE Winners & Losers

WINNERS
Kumba Iron Ore Ltd 2.31%
Clicks Group Ltd 2.20%
Naspers Limited 2.00%
Anglo American Plc 1.57%
Prosus N.V 1.57%
Show more",,2,2
TimBukOne,@TimBukOne,2024-03-06T06:04:13.000Z,"TimBukOne
@TimBukOne
Â·
Mar 6#JSE Trading Stats - 05/03/2024 - #Hammerson #Naspers #BHPGroup #SibanyeStillwater #AngloGold #AnheuserBusch",,,
The Lincolnian,@ThisLincolnian,2024-03-05T13:41:09.000Z,"The Lincolnian
@ThisLincolnian
Â·
Mar 5BHP Group Limited $BHP to Issue Semi-annual Dividend of $1.44 on  March 28th",,,
The Lincolnian,@ThisLincolnian,2024-03-05T13:41:07.000Z,"The Lincolnian
@ThisLincolnian
Â·
Mar 5BHP Group Limited $BHPLF To Go Ex-Dividend on March 7th",,,
Jake P. Noch,@Jake_P_Noch,2024-03-05T09:50:21.000Z,"Jake P. Noch
@Jake_P_Noch
Â·
Mar 5
Automated$SPY $SONG $QQQ BHP Group downgraded to Hold from Buy at Liberum https://blog.tipranks.com/bhp-group-downgraded-to-hold-from-buy-at-liberum/?utm_source=dlvr.it&utm_medium=twitterâ€¦ $BTC",,,
Gold Telegraph,@GoldTelegraph_,2024-03-04T17:46:22.000Z,"Gold Telegraph
@GoldTelegraph_
Â·
Mar 4BREAKING NEWS

BHP GROUP HOPES TO EXPAND ITS PRESENCE IN CANADA BEYOND A MASSIVE $14 BILLION POTASH PROJECT

Canada and mining  

Watch copper dealsâ€¦",12,56,344
TimBukOne,@TimBukOne,2024-03-04T08:05:37.000Z,"TimBukOne
@TimBukOne
Â·
Mar 4Upcoming Last-Day-to-Trade for #JSE Dividends - #BHPGroup #DRDGold #Italtile #South32",,1,4
Pauley,@pauley1,2024-03-04T07:51:43.000Z,"Pauley
@pauley1
Â·
Mar 4The next ex-dividend date for LSE listed mining giant  BHP Group Ltd (BHP) is scheduled for:

 Ex-Dividend date:  7th March
 Declared dividend:  $0.72 per share
 Pay date:  28th March",1,1,
ZoomStocks Markets,@ZSMarkets,2024-03-04T07:35:41.000Z,"ZoomStocks Markets
@ZSMarkets
Â·
Mar 4#Australia: Stocks on the move today

âœ¦Mining stocks slump as #StBarbara gold mineralization

#BHP Group 1.5%, #RioTinto 1.2%

âœ¦Healthcare stocks lead the gains

#RamsayHealthcare â–²0.5%, #Summerset Group â–²0.3%
Show more",,1,
CommSec,@CommSec,2024-03-04T01:16:16.000Z,"CommSec
@CommSec
Â·
Mar 4Miners edged up 0.2% before trading flat, with behemoth BHP Group $BHP declining 0.5%, while Rio Tinto $RIO and Fortescue $FMG rose 0.2% and 0.3%, respectively.",1,1,2
"Music Licensing, Inc. (OTC: SONG)",@OTC_SONG,2024-03-03T12:25:11.000Z,"Music Licensing, Inc. (OTC: SONG)
@OTC_SONG
Â·
Mar 3
Automated$TSLA  $SPY $SONG  Analysts Conflicted on These Materials Names: Northern Star Resources Ltd (OtherNESRF), Fortescue Metals Group Ltd (OtherFSUMF) and BHP Group Ltd (OtherBHPLF) https://blog.tipranks.com/analysts-conflicted-on-these-materials-names-northern-star-resources-ltd-othernesrf-fortescue-metals-group-ltd-otherfsumf-and-bhp-group-ltd-otherbhplf/?utm_source=dlvr.it&utm_medium=twitterâ€¦ $QQQ $AAPL $BTC",,,
Jake P. Noch,@Jake_P_Noch,2024-03-03T12:25:06.000Z,"Jake P. Noch
@Jake_P_Noch
Â·
Mar 3
Automated$SPY $SONG $QQQ Analysts Conflicted on These Materials Names: Northern Star Resources Ltd (OtherNESRF), Fortescue Metals Group Ltd (OtherFSUMF) and BHP Group Ltd (OtherBHPLF) https://blog.tipranks.com/analysts-conflicted-on-these-materials-names-northern-star-resources-ltd-othernesrf-fortescue-metals-group-ltd-otherfsumf-and-bhp-group-ltd-otherbhplf/?utm_source=dlvr.it&utm_medium=twitterâ€¦ $BTC",1,,
Silver,@meraipanu,2024-03-03T09:49:29.000Z,"Silver
@meraipanu
Â·
Mar 3Replying to 
@safinaMarch
 @obantoo
 and 
@AshleaSimonBF",,,
Aaron,@Awwrnold,2024-03-03T04:07:11.000Z,"Aaron
@Awwrnold
Â·
Mar 3Replying to 
@JoeFromUtah",1,,
TimBukOne,@TimBukOne,2024-03-02T08:00:36.000Z,"TimBukOne
@TimBukOne
Â·
Mar 2Upcoming Last-Day-to-Trade for #JSE Dividends - #BHPGroup #DRDGold #Italtile #South32",,,
TimBukOne,@TimBukOne,2024-03-02T06:02:37.000Z,"TimBukOne
@TimBukOne
Â·
Mar 2#JSE Trading Stats - 01/03/2024 - #Hammerson #Naspers #BHPGroup #SibanyeStillwater #Firstrand #AnheuserBusch",1,,
NAI500,@NAI500,2024-03-01T22:30:14.000Z,"NAI500
@NAI500
Â·
Mar 1[2024å¹´å…¨çƒå¸‚å€¼æœ€å¤§çš„4åª #é“€ è‚¡ç¥¨]

BHP Group Ltd. $BHP
Cameco Corp $CCO
NexGen Energy Ltd $NXE
Uranium Energy Corp $UEC

æ·±å…¥äº†è§£ï¼šhttps://ow.ly/YUll50QJYUZ

#mining #cleanenergy #uranium",,,
TimBukOne SENS,@TimBukOneSENS,2024-03-01T05:09:14.000Z,"TimBukOne SENS
@TimBukOneSENS
Â·
Mar 1#BHPGroup $JSEBHG - SENS PDF: http://dlvr.it/T3SBXB",,,
CommSec,@CommSec,2024-03-01T01:49:48.000Z,"CommSec
@CommSec
Â·
Mar 1Australian shares hit a record high on Friday, fuelled by miners and gold stocks. Miners rose 1.4%. Mining giants BHP Group $BHP rose 1% while Pilbara Minerals $PLS gained 4.8%, hitting its highest level since Sept. 18.",1,8,20
TimBukOne Candlesticks,@TimBukOneCandle,2024-02-29T22:15:38.000Z,"TimBukOne Candlesticks
@TimBukOneCandle
Â·
Feb 29#BHPGroup $JSEBHG - Search: http://dlvr.it/T3RfGp",,,
MinerÃ­a en lÃ­nea,@Mineriaenlinea,2024-02-29T21:32:22.000Z,"MinerÃ­a en lÃ­nea
@Mineriaenlinea
Â·
Feb 29Descubre cÃ³mo #BHPGroup estÃ¡ liderando el camino hacia una minerÃ­a mÃ¡s eficiente y sostenible.  #MinerÃ­aSostenible #InnovaciÃ³n

https://mineriaenlinea.com/2024/02/reestructuracion-de-bhp-group-ltd-impacto-y-estrategias-para-una-mineria-eficiente/â€¦",,,
Ramakrishna TBRC,@sreeramtbrc,2024-02-29T17:22:00.000Z,"Ramakrishna TBRC
@sreeramtbrc
Â·
Feb 29Mining Market Size, Share, Analysis, Growth, Trends, Industry Report 2024-2033|BHP Group Limited, Rio Tinto Group, Glencore PLC, Vale S.A., China Shenhua Energy Company Limited",,,2
TimBukOne,@TimBukOne,2024-02-29T08:04:35.000Z,"TimBukOne
@TimBukOne
Â·
Feb 29Upcoming Last-Day-to-Trade for #JSE Dividends - #BHPGroup #DRDGold #Italtile #South32",,1,
my dreams are who I'm racing with,@buny_n,2024-02-29T07:33:12.000Z,"my dreams are who I'm racing with
@buny_n
Â·
Feb 29Replying to 
@AfricaFactsZone",,,
ZoomStocks Markets,@ZSMarkets,2024-02-29T07:17:18.000Z,"ZoomStocks Markets
@ZSMarkets
Â·
Feb 29#Australia: Stocks on the move today

âœ¦Mining stocks trade mixed as #PanteraMinerals acquires Daytona Lithium

#BHP Group 0.1%, #RioTinto â–²0.3%

âœ¦Banks lead the gains amongst sectors

#CBA â–²0.4%, #WestpacBanking â–²0.6%
Show more",1,1,1
NM1,@AimforProfit,2024-02-29T07:02:03.000Z,"NM1
@AimforProfit
Â·
Feb 29#BHP BHP Group Limited - Director/PDMR Shareholding #BHP 
@bhp
 https://voxmarkets.co.uk/rns/announcement/a1eb1164-f77a-45fc-b5da-7cda62b68cc5â€¦ #voxmarkets #investing #shares #RNS via 
@voxmarkets",,,
TimBukOne,@TimBukOne,2024-02-29T06:00:40.000Z,"TimBukOne
@TimBukOne
Â·
Feb 29#JSE Trading Stats - 28/02/2024 - #RedefineProperties #Naspers #BHPGroup #KIBOEnergy #Firstrand #AnheuserBusch",1,1,
TimBukOne Charts,@TimBukOneCharts,2024-02-29T05:34:34.000Z,"TimBukOne Charts
@TimBukOneCharts
Â·
Feb 29#BHPGroup $JSEBHG has issued a market related announcement: http://dlvr.it/T3PYFm",1,,
TimBukOne SENS,@TimBukOneSENS,2024-02-29T05:11:42.000Z,"TimBukOne SENS
@TimBukOneSENS
Â·
Feb 29#BHPGroup $JSEBHG - SENS PDF: http://dlvr.it/T3PWmJ",,,
PiQ,@PiQSuite,2024-02-29T02:11:53.000Z,"PiQ
@PiQSuite
Â·
Feb 29  BHP TO RESTRUCTURE SOME GLOBAL CORPORATE ROLES AS IT LOOKS TO TRIM COSTS

Full Story â†’ https://PiQSuite.com/reuters/bhp-tors/bhp-to-restructure-some-global-corporate-roles-as-it-looks-to-trim-costsâ€¦

The world's biggest listed miner BHP Group said on Thursday it was disbanding some global teams and transferring those roles covering functions including planning,â€¦
Show more",1,1,1
TimBukOne,@TimBukOne,2024-02-28T08:01:34.000Z,"TimBukOne
@TimBukOne
Â·
Feb 28Upcoming Last-Day-to-Trade for #JSE Dividends - #BHPGroup #DRDGold #Italtile #South32 #Zeder",,,
TimBukOne,@TimBukOne,2024-02-28T06:01:12.000Z,"TimBukOne
@TimBukOne
Â·
Feb 28#JSE Trading Stats - 27/02/2024 - #RedefineProperties #Naspers #BHPGroup #Growthpoint #Firstrand #AnheuserBusch",,,
CommSec,@CommSec,2024-02-28T01:26:30.000Z,"CommSec
@CommSec
Â·
Feb 28Miners gained 0.3% after iron ore prices rebounded overnight on hopes of a demand recovery in top buyer China. BHP Group $BHP and Rio Tinto $RIO gained 0.4% and 1.2%, respectively, while Fortescue $FMG dropped 3%.",,1,3
TimBukOne,@TimBukOne,2024-02-27T08:02:35.000Z,"TimBukOne
@TimBukOne
Â·
Feb 27Upcoming Last-Day-to-Trade for #JSE Dividends - #AfricanAndOverseas #Hudaco #RexTrueform #Textainer #Tharisa #BHPGroup #DRDGold #Italtile #South32 #Zeder",,,2
TimBukOne,@TimBukOne,2024-02-27T06:01:37.000Z,"TimBukOne
@TimBukOne
Â·
Feb 27#JSE Trading Stats - 26/02/2024 - #RedefineProperties #Naspers #BHPGroup #Growthpoint #Firstrand #AnheuserBusch",,,
TimBukOne Charts,@TimBukOneCharts,2024-02-27T05:31:06.000Z,"TimBukOne Charts
@TimBukOneCharts
Â·
Feb 27#BHPGroup $JSEBHG has issued a market related announcement: http://dlvr.it/T3J89K",,,
TimBukOne SENS,@TimBukOneSENS,2024-02-27T05:16:11.000Z,"TimBukOne SENS
@TimBukOneSENS
Â·
Feb 27#BHPGroup $JSEBHG - SENS PDF: http://dlvr.it/T3J7Hc",,,
CommSec,@CommSec,2024-02-27T00:14:35.000Z,"CommSec
@CommSec
Â·
Feb 27Fortescue $FMG slips as much as 2.8%, while peers BHP Group $BHP and Rio Tinto $RIO retreat as much as 1.3% and 1.8%, respectively.",,,5
Peggy Sanders,@peggymel2001,2024-02-26T21:17:28.000Z,"Peggy Sanders
@peggymel2001
Â·
Feb 26The mining companies had much bigger gaps, with BHP Group reporting 20.3%, and Rio Tinto 13.5%.
Qantas reported 37% and Telstra Group 20.2%.  https://theconversation.com/qantas-pays-women-37-less-telstra-and-bhp-20-fifty-years-after-equal-pay-laws-we-still-have-a-long-way-to-go-223870â€¦.",,1,1
Stunned Ox,@LoneSaxon,2024-02-26T20:56:14.000Z,"Stunned Ox
@LoneSaxon
Â·
Feb 26BHP Group (http://BHP.AX), the world's largest shipper of metallurgical coal, believes the market has decades of life left in it as the alternatives to using coal to make steel are either not competitive on a cost basis or unlikely to emerge at scale for decades.",1,,
tony sagami,@anthonysagami,2024-02-26T15:40:00.000Z,"tony sagami
@anthonysagami
Â·
Feb 26  Top 10 uranium-producing companies (3 listed)

1. JSC National Atomic (LSE:KAP)
2. Cameco $CCJ
3. Orano
4. China General Nuclear Power
5. Uranium One
6. Navoi Mining and Metallurgy
7.  China National Nuclear Corp
8. BHP Group $BHP
9. ARMZ Uranium
10. General Atomics
Show more",,,
The Markets Daily,@TheMarketsDaily,2024-02-24T10:00:42.000Z,"The Markets Daily
@TheMarketsDaily
Â·
Feb 24http://StockNews.com Lowers BHP Group $BHP to Hold https://ift.tt/q4FZmGU",,,
TimBukOne,@TimBukOne,2024-02-24T06:03:37.000Z,"TimBukOne
@TimBukOne
Â·
Feb 24#JSE Trading Stats - 23/02/2024 - #Finbond #Naspers #BHPGroup #SibanyeStillwater #AngloGold #AnheuserBusch",,,1
Lutessia IA,@Lutessia_IA,2024-02-23T20:20:08.000Z,"Lutessia IA
@Lutessia_IA
Â·
Feb 23 $BHP #BHPGROUP - 1H: Sur cette unitÃ© de temps, la tendance de fond est trÃ¨s baissiÃ¨re sur BHP GROUP LTD. mais les acheteurs ont besoin de reprendre leur souffle Ã ...",,,
Support BAILII,@BAILII,2024-02-23T17:05:34.000Z,"Support BAILII
@BAILII
Â·
Feb 23[NEW] Municipio de Mariana & Ors v BHP Group (UK) Ltd & Anor [2024] EWHC 192 (TCC) (31 January 2024) https://bailii.org/ew/cases/EWHC/TCC/2024/192.htmlâ€¦",,,2
Support BAILII,@BAILII,2024-02-23T15:57:33.000Z,"Support BAILII
@BAILII
Â·
Feb 23[NEW] MunicÃ­pio De Mariana & Os v BHP Group (UK) Ltd & Anor [2024] EWHC 207 (TCC) (01 February 2024) https://bailii.org/ew/cases/EWHC/TCC/2024/207.htmlâ€¦",,,2
TimBukOne,@TimBukOne,2024-02-23T06:03:17.000Z,"TimBukOne
@TimBukOne
Â·
Feb 23#JSE Trading Stats - 22/02/2024 - #SibanyeStillwater #GoldFields #BHPGroup #PicknPay #Firstrand #AnheuserBusch",1,,
CommSec,@CommSec,2024-02-23T01:06:20.000Z,"CommSec
@CommSec
Â·
Feb 23On the other hand, heavyweight miners were down 0.1%, set for a third consecutive weekly loss. Still, BHP Group $BHP, Rio Tinto $RIO and Fortescue $FMG gained between 0.2% and 0.7%.",,,
TimBukOne Candlesticks,@TimBukOneCandle,2024-02-22T22:10:07.000Z,"TimBukOne Candlesticks
@TimBukOneCandle
Â·
Feb 22#BHPGroup $JSEBHG - Search: http://dlvr.it/T36xgH",,,
ZoomStocks Markets,@ZSMarkets,2024-02-22T07:24:58.000Z,"ZoomStocks Markets
@ZSMarkets
Â·
Feb 22#Australia: Stocks on the move today

âœ¦Mining stocks fall as #NagambieResources announces management change

#BHPGroup 0.4%, #RioTinto 1.1%

âœ¦IT stocks emerge as top gainers for the day

#Xero â–²2.3%, #NextDc â–²0.6%
Show more",1,1,
TimBukOne,@TimBukOne,2024-02-22T06:03:17.000Z,"TimBukOne
@TimBukOne
Â·
Feb 22#JSE Trading Stats - 21/02/2024 - #SibanyeStillwater #Naspers #BHPGroup #Ellies #Glencore #AnheuserBusch",,1,
buysellsignals,@selltipsdotcom,2024-02-21T18:42:03.000Z,"buysellsignals
@selltipsdotcom
Â·
Feb 21BHP Group (BHP: GBX2,292.50) drops to four-month low on firm volume; -GBX3.50 [-0.2%] Vol Index 1.4 [1 is avg]",,,
CentralCharts EN,@CentralChartsEN,2024-02-21T15:25:26.000Z,"CentralCharts EN
@CentralChartsEN
Â·
Feb 21 $BHP #BHPGROUP - Daily: All elements being clearly bearish, it would be possible for traders to trade only short positions (for sale) on BHP GROUP LTD. as long as... 
@Londinia_IA",,,
Londinia IA,@Londinia_IA,2024-02-21T15:25:25.000Z,"Londinia IA
@Londinia_IA
Â·
Feb 21 $BHP #BHPGROUP - Daily: All elements being clearly bearish, it would be possible for traders to trade only short positions (for sale) on BHP GROUP LTD. as long as the price...",,,
OutletMinero,@Outletminero,2024-02-21T14:50:59.000Z,"OutletMinero
@Outletminero
Â·
Feb 21BHP Group informa de estabilidad en sus ganancias del primer semestre, pero advierte sobre el impacto de la inflaciÃ³n y las altas tasas de interÃ©s en el futuro. La mayor empresa minera del mundo se prepara para desafÃ­os econÃ³micos mientras continÃºa impulsando la industria. #BHPâ€¦
Show more",,,1
TimBukOne,@TimBukOne,2024-02-21T06:02:16.000Z,"TimBukOne
@TimBukOne
Â·
Feb 21#JSE Trading Stats - 20/02/2024 - #RedefineProperties #MTN #BHPGroup #SibanyeStillwater #Naspers #AnheuserBusch",1,,1
Moneyweb News,@Moneyweb,2024-02-21T05:50:12.000Z,"Moneyweb News
@Moneyweb
Â·
Feb 21Today on the #MoneywebNOW #podcast with 
@SimonPb
: Analysis of results from BHP Group and why you may need to reduce your US equity exposure.

Download podcast:",,1,3
CommSec,@CommSec,2024-02-21T01:44:03.000Z,"CommSec
@CommSec
Â·
Feb 21Miners retreated as much as 2.8% to hit its lowest level since October 25, after iron ore futures fell overnight. BHP Group $BHP Fortescue $FMG and Rio Tinto $RIO shed between 2.7% and 3.7%, respectively.",,2,3
BeeBeeAI,@BeeBee_AI23,2024-02-21T01:00:00.000Z,"BeeBeeAI
@BeeBee_AI23
Â·
Feb 21 Earnings Alert for Feb 20:
 $WMT - Walmart
 $HD - Home Depot
 $HSBC - HSBC Holdings
 $PANW - Palo Alto Networks
 $BHP - BHP Group
 $BCS - Barclays
 $MDT - Medtronic
 $PSA - Public Storage
 $KEYS - Keysight Technologies
Show more",,,1
Laurentiu B .,@laurbjn,2024-02-20T23:34:07.000Z,"Laurentiu B .
@laurbjn
Â·
Feb 21The changing nature of China's commodity demand is neatly encapsulated by the latest results of BHP Group, the world's biggest mining company and a major supplier to the top global buyer of iron ore, coal and copper.
https://reuters.com/markets/commodities/chinas-shift-steady-commodity-demand-echoes-bhp-results-russell-2024-02-20/â€¦",,,1
MinerÃ­a Hoy,@MineriaHoyPeru,2024-02-20T14:58:06.000Z,"MinerÃ­a Hoy
@MineriaHoyPeru
Â·
Feb 20BHP Group reporta beneficio estable en el primer semestre pero prevÃ© mayores costos por inflaciÃ³n global.
Lee mÃ¡s â–º https://bitly.ws/3dFQJ

#BHPGroup #InflaciÃ³nGlobal #ResultadosFinancieros",,,
finqube,@finqube,2024-02-20T12:06:00.000Z,"finqube
@finqube
Â·
Feb 20Happy  BHP Group $BHP Earnings Day 

 Q4 non-GAAP EPS est. $1.19 (YoY: -7%)
 Q4 Revenue est. $19.49 billion (YoY: 13%)

 ROIC: 21.43%
 Net Margin: 24.40%
 3Y Expected Growth: -1.22%
 Quality Score: 
Show more",,,2
æ¨ªç”° æ·³,@fitzsimmons151,2024-02-20T10:53:30.000Z,"æ¨ªç”° æ·³
@fitzsimmons151
Â·
Feb 20On Tuesday, BHP Group reported a first-half underlying profit that slightly surpassed analysts' expectations. The company attributed this positive performance to robust iron ore prices and also noted that the impacts of inflation were diminishing.",15,,10
PatronusPartnersLtd,@PatronusLtd,2024-02-20T09:13:02.000Z,"PatronusPartnersLtd
@PatronusLtd
Â·
Feb 20Today we discuss results from hotel group IHG and miner BHP Group.",,,
CommSec,@CommSec,2024-02-20T09:10:00.000Z,"CommSec
@CommSec
Â·
Feb 20[VIDEO] BHP Group $BHP Half Year Result: A flat result in challenging times",1,,5
Bloomberg Technoz,@BloombergTZ,2024-02-20T08:53:33.000Z,"Bloomberg Technoz
@BloombergTZ
Â·
Feb 20Pasokan Nikel Dunia Berlimpah, Bikin Laba BHP Group Anjlok 86%",,,
Usa Jaun News,@UsaJaunNews,2024-02-20T08:16:48.000Z,"Usa Jaun News
@UsaJaunNews
Â·
Feb 20BHP trims payouts as nickel glut and dam disaster wipes billions from bottom-line 

 Tuesday 20 February 2024 ... Tuesday 20 February 2024 8:05 am BHP saw first half net income slump 86 per cent BHP Group has watered down its dividend after a stee...",,,
Investor-SMS,@InvestorSMS,2024-02-20T07:53:10.000Z,"Investor-SMS
@InvestorSMS
Â·
Feb 20BHP Group: Wichtige Volkswirtschaften kommen nicht in Fahrt http://dlvr.it/T2zmZP",,,
The Dude,@Redpanda73,2024-02-20T07:44:29.000Z,"The Dude
@Redpanda73
Â·
Feb 20#BHP BHP GROUP HY â€“ Numbers broadly in-line, dividend better. Positive outlook for China and India. Trading -1% in aus",,,
TimBukOne Charts,@TimBukOneCharts,2024-02-20T06:35:06.000Z,"TimBukOne Charts
@TimBukOneCharts
Â·
Feb 20#BHPGroup $JSEBHG has issued a market related announcement: http://dlvr.it/T2zdwV",,1,
TimBukOne SENS,@TimBukOneSENS,2024-02-20T06:33:34.000Z,"TimBukOne SENS
@TimBukOneSENS
Â·
Feb 20#BHPGroup $JSEBHG - SENS PDF: http://dlvr.it/T2zdq8",,,
aktien.guide,@aktien_guide,2024-02-20T06:30:00.000Z,"aktien.guide
@aktien_guide
Â·
Feb 20 Anstehende #Quartalszahlen fÃ¼r Heute 20.02.2024:
âœ $WMT Walmart
âœ $HD Home Depot
âœ $O Realty Income
âœ $PSA Public Storage
âœ $BHP BHP Group
...",,2,13
TimBukOne,@TimBukOne,2024-02-20T06:01:12.000Z,"TimBukOne
@TimBukOne
Â·
Feb 20#JSE Trading Stats - 19/02/2024 - #RedefineProperties #Naspers #BHPGroup #Growthpoint #AngloAmerican #AnheuserBusch",,2,1
CommSec,@CommSec,2024-02-20T05:49:09.000Z,"CommSec
@CommSec
Â·
Feb 20[VIDEO] BHP Group $BHP Half Year Result: A flat result in challenging times",,,1
BBCVIRAL.COM,@pivxcoin,2024-02-20T02:40:06.000Z,"BBCVIRAL.COM
@pivxcoin
Â·
Feb 20BHP half-year profit beats expectations, inflation impact recedes: BHP Group logged first-half underlying profit that slightly beat expectations, buoyed by strong iron ore prices, and said inflationary impacts were receding. http://dlvr.it/T2zLkj",,,
El Dia Noticiario,@ElDiaNoticiario,2024-02-20T01:22:03.000Z,"El Dia Noticiario
@ElDiaNoticiario
Â·
Feb 20BHP Pares Midyear Payout After Net Profit Fall, Flat Earnings: BHP Group dialed back its dividend on Tuesday as the worldâ€™s biggest miner reported a steep fall in http://eldianoticiario.site/bhp-pares-midyear-payout-after-net-profit-fall-flat-earnings/?utm_source=dlvr.it&utm_medium=twitterâ€¦",,,
CommSec,@CommSec,2024-02-20T01:06:23.000Z,"CommSec
@CommSec
Â·
Feb 20The mining sector retreated 0.6%, with Rio Tinto $RIO and Fortescue $FMG losing 0.8% and 0.4%, respectively. BHP Group $BHP lost 0.5% after the world's largest-listed miner said its first-half underlying profit was largely unchanged from a year earlier, but flagged higher costs.",,,1
PiQ,@PiQSuite,2024-02-19T21:53:45.000Z,"PiQ
@PiQSuite
Â·
Feb 19  BHP REPORTS FLAT FIRST-HALF UNDERLYING PROFIT, WARNS OF INFLATION IMPACT

Full Story â†’ https://PiQSuite.com/reuters/bhp-rers/bhp-reports-flat-first-half-underlying-profit-warns-of-inflation-impactâ€¦

BHP Group said its first-half underlying profit was largely unchanged from a year ago on Tuesday citing strong revenue generation, but warned the lagged effect ofâ€¦
Show more",5,,3
Andy Vermaut,@AndyVermaut,2024-02-19T23:49:09.000Z,"Andy Vermaut
@AndyVermaut
Â·
Feb 20Andy Vermaut shares:BHP Reports Steep Fall in First-Half Net Profit: BHP Group reported an 86% drop in first-half net profit as it wrote down the value of its nickel operations and set aside more cash to cover costs associated with the 2015â€¦ https://wsj.com/articles/bhp-reports-steep-fall-in-first-half-net-profit-c6838296?utm_source=dlvr.it&utm_medium=twitterâ€¦ Thank you!",,,
Markets News,@MarketsDotNews,2024-02-20T01:06:16.000Z,"Markets News
@MarketsDotNews
Â·
Feb 20TAIWAN DEFENSE MINISTRY REPORTS 11 CHINESE AIR FORCE PLANES CROSS MEDIAN LINE OF TAIWAN STRAIT IN 24 HOURS

$BHP GROUP REPORTS 86% DROP IN FIRST-HALF NET PROFIT DUE TO WRITE-DOWNS AND INCREASED CASH RESERVES FOR SAMARCO DISASTER.",1,1,1
CommSec,@CommSec,2024-02-19T21:31:05.000Z,"CommSec
@CommSec
Â·
Feb 19BHP Group $BHP said its first-half underlying profit was largely unchanged from a year ago on Tuesday, citing strong revenue generation and disciplined cost control.",,1,3
CommSec,@CommSec,2024-02-19T21:26:55.000Z,"CommSec
@CommSec
Â·
Feb 19$BHP BHP
Revenue Up 6% to US$27,232m
Profit after taxation attributable to the members of the BHP Group: down 86% to US$927m
Underlying attributable profit, US$6.6 billion
Dividend: US72c/share
#ausecon #auspol #commsec 
@CommSec
 #reportingseason #earningsseason",,3,10
sureshgeorge,@sureshgeorge,2024-02-18T13:35:08.000Z,"sureshgeorge
@sureshgeorge
Â·
Feb 18#climatechange #nature #naturalresources #marketeconomics #globestrategy #greenpeaceExxon Mobil profits are $36bn. Zijin Mining Group profits are $28.43 bn Shell profits are $28.2 bn TotalEnergies profits are $21.4 bn Vale profits are $16.17 bn
BHP Group profits are $14.1 bn",1,,
Transcript Daily,@TranscriptDaily,2024-02-18T06:18:54.000Z,"Transcript Daily
@TranscriptDaily
Â·
Feb 18BHP Group $BHP to Release Quarterly Earnings on Tuesday",,,
Moose,@SimplyOneMoOsE,2024-02-17T21:42:55.000Z,"Moose
@SimplyOneMoOsE
Â·
Feb 17Important Data and Thoughts for the Week (2/18/24):

Monday (2/19/24)
Markets Closed due to US Holiday (Presidentâ€™s Day).
Notable Earnings:
$BHP - BHP Group (After Hours)

Tuesday (2/20/24)
-US Leading Index (Jan).
-Multiple Treasury Auctions.
Notable Earn
Show more",,1,
ComunÃ¡lisis,@Comunalisis,2024-02-17T20:40:42.000Z,"ComunÃ¡lisis
@Comunalisis
Â·
Feb 17Replying to 
@Comunalisis",1,,
sureshgeorge,@sureshgeorge,2024-02-17T18:23:27.000Z,"sureshgeorge
@sureshgeorge
Â·
Feb 17Replying to 
@sureshgeorge",,,
ğ™±ğš•ğšŠğšŒğš”ğš•ğšğšğšğš ğšŠğšğšğšğš› ğš‘ğš˜ğšğš›ğšœ,@KohSongCapital,2024-02-17T10:17:56.000Z,"ğ™±ğš•ğšŠğšŒğš”ğš•ğšğšğšğš ğšŠğšğšğšğš› ğš‘ğš˜ğšğš›ğšœ
@KohSongCapital
Â·
Feb 17 ""Weak #nickel prices have forced Australia's high cost producers to announce several writedowns and restructures, and analysts said last month it will force a rethink by top global miner BHP Group on its nickel strategy this year."" #Mining",,,
Usa Jaun News,@UsaJaunNews,2024-02-17T06:07:05.000Z,"Usa Jaun News
@UsaJaunNews
Â·
Feb 17Western Australia offers royalty relief to struggling nickel producers By Reuters 

Â© Reuters. FILE PHOTO: A ton of nick... Â© Reuters. FILE PHOTO: A ton of nickel powder made by BHP Group sits in a warehouse at its Nickel West division, south of Perth...",1,,3
TimBukOne,@TimBukOne,2024-02-17T06:03:14.000Z,"TimBukOne
@TimBukOne
Â·
Feb 17#JSE Trading Stats - 16/02/2024 - #RedefineProperties #Naspers #BHPGroup #SYNERGYB #Firstrand #AnheuserBusch",2,,
Nikkei Asia,@NikkeiAsia,2024-02-16T15:44:10.000Z,"Nikkei Asia
@NikkeiAsia
Â·
Feb 16Rail workers for Australian mining giant BHP Group have canceled a planned strike after the two sides reached an agreement that would raise wages by 20% over four years.",,1,4
Shaun Murison,@ShaunMurison_IG,2024-02-16T11:52:44.000Z,"Shaun Murison
@ShaunMurison_IG
Â·
Feb 16BHP Group price targets & ratings after impairments and provisions news (image: IG TipRanks) https://ig.com/uk/news-and-trade-ideas/bhp-group-price-targets-and-ratings-after-impairments-and-provis-240216â€¦ 
@IGcom
 @IGAus
 @IGSouthAfrica",,,1
TimBukOne,@TimBukOne,2024-02-16T06:04:12.000Z,"TimBukOne
@TimBukOne
Â·
Feb 16#JSE Trading Stats - 15/02/2024 - #Copper360 #Naspers #BHPGroup #Firstrand #AnheuserBusch",,,
CommSec,@CommSec,2024-02-16T01:43:46.000Z,"CommSec
@CommSec
Â·
Feb 16The heavyweight mining sector gained 1.1%, their biggest intraday jump since February. 7. Top miners BHP Group $BHP, Rio Tinto $RIO, Fortescue $FMG gained 0.7%, 1.1% and 0.8%, respectively.",,,6
V.O.H,@Knot73211261,2024-02-15T22:46:51.000Z,"V.O.H
@Knot73211261
Â·
Feb 15Australia's BHP faces strike from iron ore freight train drivers

Mining giant BHP Group's iron ore operations in the state of Western Australia face a strike by freight train workers that is set to start Friday.",,2,2
Roger,@Roger6Murray,2024-02-15T14:59:08.000Z,"Roger
@Roger6Murray
Â·
Feb 15#BHP ""UK earnings season is in full swing! Companies like NatWest, Segro, and BHP Group are dropping their results. Get ready for some financial fireworks! #EarningsSeason #ProfitParade""",,,
buysellsignals,@selltipsdotcom,2024-02-15T13:21:13.000Z,"buysellsignals
@selltipsdotcom
Â·
Feb 15BHP Group (BHP: GBX2,338.0) drops to four-month low; -GBX33 [-1.4%]",,,
Tony,@JsoTony,2024-02-15T09:12:25.000Z,"Tony
@JsoTony
Â·
Feb 15Replying to 
@JosephCJohns",1,1,2
TimBukOne Charts,@TimBukOneCharts,2024-02-15T09:04:07.000Z,"TimBukOne Charts
@TimBukOneCharts
Â·
Feb 15#BHPGroup $JSEBHG has issued a market related announcement: http://dlvr.it/T2mr8Q",1,,
TimBukOne SENS,@TimBukOneSENS,2024-02-15T09:03:07.000Z,"TimBukOne SENS
@TimBukOneSENS
Â·
Feb 15#BHPGroup $JSEBHG - SENS PDF: http://dlvr.it/T2mr21",,,
Reuters Asia,@ReutersAsia,2024-02-15T08:30:00.000Z,"Reuters Asia
@ReutersAsia
Â·
Feb 15WATCH: BHP Group will record another $3.2 billion impairment in relation to its Brazilian Samarco dam failure, and a $2.5 billion impairment charge for its Western Australia Nickel business, the world's biggest listed miner said https://reut.rs/49vFfDm",,,2
WACONZY MUSIC,@Waconzy,2024-02-15T08:16:55.000Z,"WACONZY MUSIC
@Waconzy
Â·
Feb 15https://ift.tt/vErqG1h  BUY TIKTOK REAL FOLLOWERS
buy TIK TOK followers #TIKTOK Buy Tiktok Real Like Followers
BUY FOLLOWERS. https://ift.tt/vErqG1h #TWITTER, #INSTAGRAM , #TIKTOK,  #YOUTUBE #FOLLOWERS. DM 
@WACONZY
 BHP Group will record another $3.2 â€¦",,,
Reuters,@Reuters,2024-02-15T08:15:00.000Z,"Reuters
@Reuters
Â·
Feb 15BHP Group will record another $3.2 billion impairment in relation to its Brazilian Samarco dam failure, and a $2.5 billion impairment charge for its Western Australia Nickel business, the world's biggest listed miner said https://reut.rs/49vFfDm",1,10,14
Smalltalkdaily Research,@smalltalkdaily,2024-02-15T07:40:03.000Z,"Smalltalkdaily Research
@smalltalkdaily
Â·
Feb 15Iron ore price been flat & steady at US$129.02 = R2,454 a ton due to the extended period of the Chinese New Lunar New Year that ends 20th & industry re-commences

Train drivers at BHP Group's Pilbara iron-ore operations in Western Australia have voted to strike on Friday for 24â€¦
Show more",,,
Finans GÃ¼ndem,@finansgundemcom,2024-02-15T06:44:13.000Z,"Finans GÃ¼ndem
@finansgundemcom
Â·
Feb 15Madencilik devi BHP'de 5.7 milyar dolarlÄ±k zarar #Maden #Madencilik #Åirket #BHPGroup #BHP - https://finansgundem.com/haber/madencilik-devi-bhpde-57-milyar-dolarlik-zarar/1784435â€¦",,1,1
WeeklyFinanceNews.Online,@Wfinancenews,2024-02-15T06:24:20.000Z,"WeeklyFinanceNews.Online
@Wfinancenews
Â·
Feb 15BHP Announces $5.7 Billion Charges in First Half for Nickel Operations and Samarco Dam Failure, Stock Falls - https://weeklyfinancenews.online/2024/02/15/bhp-announces-5-7-billion-charges-in-first-half-for-nickel-operations-and-samarco-dam-failure-stock-falls/â€¦ - #BHPGroup #MiningNew...",,,
TimBukOne,@TimBukOne,2024-02-15T06:02:20.000Z,"TimBukOne
@TimBukOne
Â·
Feb 15#JSE Trading Stats - 14/02/2024 - #RedefineProperties #Naspers #BHPGroup #SibanyeStillwater #Prosus #AnheuserBusch",,,
Nikkei Asia,@NikkeiAsia,2024-02-14T19:52:32.000Z,"Nikkei Asia
@NikkeiAsia
Â·
Feb 14Mining giant BHP Group's iron ore operations in the state of Western Australia face a strike by freight train workers that is set to start Friday.",,1,3
Tiago GuitiÃ¡n Reis,@Tiagogreis,2024-02-14T17:10:44.000Z,"Tiago GuitiÃ¡n Reis
@Tiagogreis
Â·
Feb 14Maiores empresas (em valor de mercado) de cada segmento:

 Auto â†’ Tesla ($580 bi)
 AÃ©rea â†’ Ryanair ($31 bi) 
 Aircraft â†’ Airbus ($128 bi)
 En. ElÃ©trica â†’ Nextera ($114 bi)
 QuÃ­mica â†’ Linde ($202 bi)
 MineraÃ§Ã£o â†’ BHP Group ($150 bi)
 PetrÃ³leo â†’ Saudi Aramcoâ€¦
Show more",39,95,944
TimBukOne,@TimBukOne,2024-02-14T06:01:17.000Z,"TimBukOne
@TimBukOne
Â·
Feb 14#JSE Trading Stats - 13/02/2024 - #RedefineProperties #Naspers #BHPGroup #FortressReit #NepiRockcastle #AnheuserBusch",,1,
CommSec,@CommSec,2024-02-14T01:17:30.000Z,"CommSec
@CommSec
Â·
Feb 14Heavyweight miners fell 1.8% in their biggest intraday drop since November 14. BHP Group $BHP, Rio Tinto $RIO and Fortescue $FMG dropped between 1% and 2.7%.",,,4
dividendc2,@dividendc2,2024-02-13T19:28:42.000Z,"dividendc2
@dividendc2
Â·
Feb 13Las 8 mejores compaÃ±Ã­as del sector Materiales

1 $LIN Linde plc
2 $AI Air Liquide
3 $BHP BHP Group Ltd
4 $CRH CRH public limited
5 $APD Air Products and Chemicals
6 $SHW Sherwin-Williams
7 $NUE Nucor Corporation
8 $RIO Rio Tinto plc",,3,22
Climate Claims Watch,@CClaimsWatch,2024-02-13T16:45:04.000Z,"Climate Claims Watch
@CClaimsWatch
Â·
Feb 13#RioTinto and #BHPGroup have announced a pilot ""green iron"" project to reduce emissions for steelmakers relying on Australian iron ore. The first pilot electric smelting furnace will be built in #Australia, potentially starting in 2027.

https://reuters.com/markets/commodities/rio-tinto-bhp-tie-up-australian-steel-decarbonisation-pilot-2024-02-08/laimsâ€¦",,,
ChemAnalyst,@Chemanalysts,2024-02-13T06:49:20.000Z,"ChemAnalyst
@Chemanalysts
Â·
Feb 13BHP Group's #Pilbara operations in Western #Australia have been thrust into the spotlight as train drivers take a decisive step towards securing better employment conditions. http://tinyurl.com/bdf5kpjj
@bhp
 

#BHPGroup #PilbaraIronOreIndustry",,,1
TimBukOne,@TimBukOne,2024-02-13T06:01:13.000Z,"TimBukOne
@TimBukOne
Â·
Feb 13#JSE Trading Stats - 12/02/2024 - #RedefineProperties #Naspers #BHPGroup #SibanyeStillwater #Shoprite #AnheuserBusch",,,1
CommSec,@CommSec,2024-02-13T01:02:10.000Z,"CommSec
@CommSec
Â·
Feb 13Among gainers, mining stocks rose 0.7%. BHP Group $BHP climbed 0.5%, while Fortescue $FMG was up 0.4%.",,,1
Metal Expert,@MetalExpert,2024-02-12T19:18:43.000Z,"Metal Expert
@MetalExpert
Â·
Feb 12Rio Tinto, BHP Group, BlueScope Steel join forces to develop low-CO2 steel production
http://tinyurl.com/42kdw9nw
#Australia #RioTinto #BHP #BlueScope #steel #greensteel #production #technologies #decarbonisation #environment #CO2 #emissions #carbonneutral",1,2,1
ProTradeInvestor,@ProTradeIdeas,2024-02-12T13:22:59.000Z,"ProTradeInvestor
@ProTradeIdeas
Â·
Feb 12Sell BHP Group $BHP for a -4.70% Loss. Time to Buy ARCH RESOURCES INC CLASS A $ARCH.
#nifty #sensex #finnifty #giftnifty #nifty50 #intraday #Hedgefunds #ipoalert #Multibagger #BREAKOUTSTOCKS #banknifty #niftyoptions #bankniftyoptions #IntradayTrading #trading",,,1
Reuters,@Reuters,2024-02-10T08:10:00.000Z,"Reuters
@Reuters
Â·
Feb 10Iron ore producers, Rio Tinto, and BHP Group are partnering with BlueScope Steel on a â€˜green ironâ€™ project to cut emissions for steelmakers globally. If successful, this would be the first partnership between the two global miners on a downstream project https://reut.rs/48gZOT8",9,6,24
TimBukOne,@TimBukOne,2024-02-10T06:04:13.000Z,"TimBukOne
@TimBukOne
Â·
Feb 10#JSE Trading Stats - 09/02/2024 - #RedefineProperties #Naspers #BHPGroup #Growthpoint #Firstrand #AnheuserBusch",,,
Reuters,@Reuters,2024-02-10T04:10:00.000Z,"Reuters
@Reuters
Â·
Feb 10Rio Tinto and BHP Group plan to collaborate with BlueScope Steel on a pilot project aimed at decarbonizing steelmaking. The project could be commissioned as early as 2027 https://reut.rs/48gZOT8",4,4,21
Reuters Business,@ReutersBiz,2024-02-10T00:30:00.000Z,"Reuters Business
@ReutersBiz
Â·
Feb 10Rio Tinto and BHP Group plan to collaborate with BlueScope Steel on a pilot project aimed at decarbonizing steelmaking. The project could be commissioned as early as 2027 https://reut.rs/48gZOT8",2,1,3
Reuters Asia,@ReutersAsia,2024-02-10T00:20:00.000Z,"Reuters Asia
@ReutersAsia
Â·
Feb 10Rio Tinto and BHP Group plan to collaborate with BlueScope Steel on a pilot project aimed at decarbonizing steelmaking. The project could be commissioned as early as 2027 https://reut.rs/48gZOT8",,,
Reuters Business,@ReutersBiz,2024-02-09T20:30:00.000Z,"Reuters Business
@ReutersBiz
Â·
Feb 9Iron ore producers, Rio Tinto, and BHP Group are partnering with BlueScope Steel on a â€˜green ironâ€™ project to cut emissions for steelmakers globally. If successful, this would be the first partnership between the two global miners on a downstream project https://reut.rs/48gZOT8",2,2,5
Lutessia IA,@Lutessia_IA,2024-02-09T20:20:09.000Z,"Lutessia IA
@Lutessia_IA
Â·
Feb 9 $BHP #BHPGROUP - 1H: La tendance baissiÃ¨re de fond sur cette unitÃ© de temps est trÃ¨s forte pour BHP GROUP LTD. mais le court terme montre quelques signes...",,,
Reuters Asia,@ReutersAsia,2024-02-09T20:20:00.000Z,"Reuters Asia
@ReutersAsia
Â·
Feb 9Iron ore producers, Rio Tinto, and BHP Group are partnering with BlueScope Steel on a â€˜green ironâ€™ project to cut emissions for steelmakers globally. If successful, this would be the first partnership between the two global miners on a downstream project https://reut.rs/48gZOT8",,1,
Reuters,@Reuters,2024-02-09T20:10:00.000Z,"Reuters
@Reuters
Â·
Feb 9Mining rivals Rio Tinto and BHP Group joined with Australia's largest steelmaker to announce a pilot â€˜green ironâ€™ project to help cut emissions for steelmakers around the globe who rely on Australian iron ore https://reut.rs/48gZOT8",2,3,6
CommSec,@CommSec,2024-02-07T00:49:32.000Z,"CommSec
@CommSec
Â·
Feb 7On the local bourse, miners led gains with a 1.5% jump, set for their best day since Jan. 25, if trend holds. Shares of sector majors BHP Group $BHP and Fortescue $FMG were up 1.2% and 1.9%, respectively.",,1,1
TimBukOne,@TimBukOne,2024-02-06T06:01:18.000Z,"TimBukOne
@TimBukOne
Â·
Feb 6#JSE Trading Stats - 05/02/2024 - #KIBOEnergy #Naspers #BHPGroup #RedefineProperties #Capitec #AnheuserBusch",,1,3
CommSec,@CommSec,2024-02-06T00:14:24.000Z,"CommSec
@CommSec
Â·
Feb 6The heavyweight metals and mining index fell 1.4%, set for its lowest close since January 22, as iron ore futures were under pressure. BHP Group $BHP and Rio Tinto $RIO traded 1.1% and 0.6% lower, respectively.",,1,1
buysellsignals,@selltipsdotcom,2024-02-05T15:58:33.000Z,"buysellsignals
@selltipsdotcom
Â·
Feb 5BHP Group (BHP: GBX2,371.50) accelerates decline; -GBX37.50 [-1.6%]",,,
QUATRO International Inc.,@QuatroInc,2024-02-05T12:32:44.000Z,"QUATRO International Inc.
@QuatroInc
Â·
Feb 5Just 18 months ago, BHP Group, the world's largest mining company, was making significant moves in the nickel market, signing a deal with Tesla to supply the crucial material for electric vehicles....

#australia #batterymetals #BHP #criticalminerals",1,,1
CommSec,@CommSec,2024-02-05T01:19:03.000Z,"CommSec
@CommSec
Â·
Feb 5Shares of top miners BHP Group $BHP and Rio Tinto $RIO slip 2.3% and 2.1% lower, respectively. Iron ore behemoth Fortescue $FMG slumps 2.5%, set for worst day in 1 month.",,2,5
CommSec,@CommSec,2024-02-05T00:25:01.000Z,"CommSec
@CommSec
Â·
Feb 5Shares of the country's top miners BHP Group $BHP and Rio Tinto $RIO traded 2% and 1.7% lower, respectively.",,2,4
Ganga News English,@ganganewsen,2024-02-04T14:21:30.000Z,"Ganga News English
@ganganewsen
Â·
Feb 4The nickel market once considered a key pillar of growth for major mining companies like BHP Group is now in a state of chaos.

 #nickelmarket #BHPGroup #SupplyGlut #ElectricVehicles",1,,
TimBukOne,@TimBukOne,2024-02-03T06:04:13.000Z,"TimBukOne
@TimBukOne
Â·
Feb 3#JSE Trading Stats - 02/02/2024 - #Growthpoint #GoldFields #BHPGroup #Firstrand #Naspers #AnheuserBusch",,,
Clinton Weier,@ClintonWei45279,2024-02-03T05:17:13.000Z,"Clinton Weier
@ClintonWei45279
Â·
Feb 3A potential cup and handle in the making on a weekly chart for BHP group, reasonable gains to be made if it comes off.",,,3
TBOSolutions,@TBOSolutions,2024-02-02T06:45:09.000Z,"TBOSolutions
@TBOSolutions
Â·
Feb 2For info about $JSEBHG #BHPGroup and all these reports download the FREE Investors Daily Excel from https://cutt.ly/Investors-Daily-Excelâ€¦",,,
TimBukOne,@TimBukOne,2024-02-02T06:02:15.000Z,"TimBukOne
@TimBukOne
Â·
Feb 2#JSE Trading Stats - 01/02/2024 - #Growthpoint #GoldFields #BHPGroup #RedefineProperties #Naspers #AnheuserBusch",1,1,
CommSec,@CommSec,2024-02-02T01:34:22.000Z,"CommSec
@CommSec
Â·
Feb 2Mining stocks were up as much as 1.3% to their highest level since January 12. Heavyweight miners BHP Group $BHP, Rio Tinto $RIO and Fortescue $FMG gained between 0.7% and 1.3%.",,1,1
ZoomStocks Markets,@ZSMarkets,2024-02-01T13:30:18.000Z,"ZoomStocks Markets
@ZSMarkets
Â·
Feb 1#Europe: Stocks on the move today

#UK

âœ¦Media stocks gain as #Wilmington divests its mortality data business

#Ascential â–²1%, #Relx â–²0.6%

âœ¦Mining stocks emerg as the top losing sectors for the day
Show more",2,1,
CommSec,@CommSec,2024-02-01T01:36:04.000Z,"CommSec
@CommSec
Â·
Feb 1Heavyweight miners BHP Group $BHP, Rio Tinto $RIO and Fortescue $FMG lost between 0.5% and 0.7%.",,1,4
BROKSTOCK,@brokstock,2024-01-30T13:38:09.000Z,"BROKSTOCK
@brokstock
Â·
Jan 30BROKSTOCK's picks for this week:

JSE:
BHP Group Ltd
Mondi Plc
FirstRand Ltd

NYSE:
Goldman Sachs Group Inc
CVS Health Corp
Show more",,,3
TimBukOne,@TimBukOne,2024-01-30T06:03:16.000Z,"TimBukOne
@TimBukOne
Â·
Jan 30#JSE Trading Stats - 29/01/2024 - #SACorporateRealEstate #Naspers #BHPGroup #RedefineProperties #GoldFields #AnheuserBusch",,1,
Simon Brown,@SimonPB,2024-01-29T05:55:51.000Z,"Simon Brown
@SimonPB
Â·
Jan 29We also touch on BHP Group & Dis-Chem ..",,,4
CommSec,@CommSec,2024-01-29T02:00:00.000Z,"CommSec
@CommSec
Â·
Jan 29Heavyweight mining stocks fell 0.9%, with sector major BHP Group $BHP losing 1.6%. Gold stocks fell as much as 1.9%.",,1,1
David N,@ni17540437,2024-01-28T11:17:33.000Z,"David N
@ni17540437
Â·
Jan 28#HFEL Henerson Far East Income - 11.63% Yield
Top Holdings
Taiwan Semiconductor Manufacturing - Samsung Electronics
BHP Group-Vinacapital Vietnam Opportunity Fund 
Bharat Petroleum-Samsonite International-Rio Tinto
Macquarie Korea Infrastructure Fund-Macquarie Group- MediaTek",,,5
TimBukOne,@TimBukOne,2024-01-27T06:01:13.000Z,"TimBukOne
@TimBukOne
Â·
Jan 27#JSE Trading Stats - 26/01/2024 - #Dischem #BHPGroup #Growthpoint #Naspers #AnheuserBusch",,,
TimBukOne Candlesticks,@TimBukOneCandle,2024-01-26T22:03:17.000Z,"TimBukOne Candlesticks
@TimBukOneCandle
Â·
Jan 26#BHPGroup $JSEBHG - Search: http://dlvr.it/T1wqTL",,,
IniAfrica,@IniAfrica_News,2024-01-26T16:13:39.000Z,"IniAfrica
@IniAfrica_News
Â·
Jan 26BHP Group Faces Substantial Collective Moral Damages Following Brazilian Federal Court Decision - https://iniafrica.com/index.php/2024/01/26/bhp-group-faces-substantial-collective-moral-damages-following-brazilian-federal-court-decision/â€¦
#iniAfricaNews",,,
Diario La RepÃºblica,@larepublica_co,2024-01-26T16:01:36.000Z,"Diario La RepÃºblica
@larepublica_co
Â·
Jan 26BHP Group dijo que revisarÃ­a una decisiÃ³n del Tribunal Federal de Brasil en relaciÃ³n  con el colapso en 2015 de la presa de Fundao, propiedad de Samarco, su empresa conjunta con Vale",,,
Edson Ribeiro de Rothschild,@Eddie_Poker,2024-01-26T12:04:23.000Z,"Edson Ribeiro de Rothschild
@Eddie_Poker
Â·
Jan 26BHP Group revisarÃ¡ millonario fallo por rotura de presa en Brasil - https://invst.ly/135w30",,,
QUATRO International Inc.,@QuatroInc,2024-01-26T11:47:36.000Z,"QUATRO International Inc.
@QuatroInc
Â·
Jan 26Mining giant BHP Group has altered its shipping routes to Europe, diverting shipments from Asia away from the Red Sea due to the increased threat of Houthi attacks in the region....

#australia #BHP #export #geopolitics #mining #redsea",,,
Reuters Energy and Commodities,@ReutersCommods,2024-01-26T11:37:51.000Z,"Reuters Energy and Commodities
@ReutersCommods
Â·
Jan 26BHP Group to review court decision on $31.53 bln Fundao dam claim",,,1
TimBukOne SENS,@TimBukOneSENS,2024-01-26T11:36:19.000Z,"TimBukOne SENS
@TimBukOneSENS
Â·
Jan 26#BHPGroup $JSEBHG - SENS PDF: http://dlvr.it/T1vXw8",,,
Reuters,@Reuters,2024-01-26T09:55:21.000Z,"Reuters
@Reuters
Â·
Jan 26BHP Group to review court decision on $31.53 bln Fundao dam claim http://reut.rs/48PC75o",2,1,8
Dam News,@damnews_en,2024-01-26T09:40:34.000Z,"Dam News
@damnews_en
Â·
Jan 26
AutomatedBHP Group to review court decision on $31.53 billion Fundao dam claim - 1470 & 100.3 WMBD http://dlvr.it/T1vJKr #damnews #dam",,,
Dam News,@damnews_en,2024-01-26T08:23:37.000Z,"Dam News
@damnews_en
Â·
Jan 26
AutomatedBHP Group's Brazil unit to review court decision on $31.53 bln Fundao dam claim - Nasdaq http://dlvr.it/T1v8qL #damnews #dam",,,
The Dude,@Redpanda73,2024-01-26T07:51:57.000Z,"The Dude
@Redpanda73
Â·
Jan 26#BHP BHP GROUP  Media reports BHP   & Vale to pay $9.7b for dam failure in Brazil. Case ongoing nothing   settled as of yet. BHP +1.5% in AUS",,,
NM1,@AimforProfit,2024-01-26T07:03:16.000Z,"NM1
@AimforProfit
Â·
Jan 26#BHP BHP Group Limited - Response to media commentary regarding Samarco #BHP 
@bhp
 https://voxmarkets.co.uk/rns/announcement/d2be1f26-6328-4044-91d9-41e85b271e53â€¦ #voxmarkets #investing #shares #RNS via 
@voxmarkets",,,
TimBukOne,@TimBukOne,2024-01-26T06:01:19.000Z,"TimBukOne
@TimBukOne
Â·
Jan 26#JSE Trading Stats - 25/01/2024 - #TsogoSun #Naspers #BHPGroup #Firstrand #AnheuserBusch",,,
Rehmanullah,@Rehman3214,2024-01-26T03:04:16.000Z,"Rehmanullah
@Rehman3214
Â·
Jan 26BHP Group and Vale ordered to pay $15bn in damages for 2015 Brazil dam collapse
Mining companies and their joint venture Samarco ordered by Brazilian judge to pay AU$14.7bn over disaster that killed 19 people

#SunRiseWithAdeel",,,1
News That Matter,@jay1stnewyorker,2024-01-26T02:29:22.000Z,"News That Matter
@jay1stnewyorker
Â·
Jan 26Australian BHP Group says almost all its ships diverted from Red Sea",,,
Gwen Anderson,@NewsondaBrain,2024-01-26T00:46:11.000Z,"Gwen Anderson
@NewsondaBrain
Â·
Jan 26""BHP Group Routes Rerouted as Red Sea Security Concerns Escalate"" #Short... https://youtu.be/GkV7Fw8m6JI?si=6bSPI4EvSRkrWcQZâ€¦ via 
@YouTube",,,
Gwen Anderson,@NewsondaBrain,2024-01-26T00:40:39.000Z,"Gwen Anderson
@NewsondaBrain
Â·
Jan 26""BHP Group Joins Shift in Shipping Routes Amid Rising Houthi Threats"" Sh... https://youtu.be/E1rAl7rFe1s?si=lh3nYCjS2H38SDlBâ€¦ via 
@YouTube",,,
Kayhan Life,@KayhanLife,2024-01-25T20:15:36.000Z,"Kayhan Life
@KayhanLife
Â·
Jan 25Australian mining giant BHP Group http://BHP.AX said that the Red Sea disruptions are forcing some of its freight service providers to take alternative routes, such as Africaâ€™s Cape of Good Hope",,1,5
Martino Loiacono,@martinoloiacono,2024-01-25T18:23:59.000Z,"Martino Loiacono
@martinoloiacono
Â·
Jan 25Lâ€™Iran starebbe inviando armi sempre piÃ¹ potenti e sofisticate agli Houthi. Nel frattempo, dopo Shell e Qatar energy, anche BHP Group ha interrotto le spedizioni che transitavano dal Mar Rosso. Il traffico marittimo dallâ€™Asia allâ€™Europa passa sempre piÃ¹ dal Capo di Buonaâ€¦
Show more",2,,13
Kyle Anzalone,@KyleAnzalone_,2024-01-25T18:23:01.000Z,"Kyle Anzalone
@KyleAnzalone_
Â·
Jan 25More Shipping Companies Announce They Will Avoid Red Sea

Business Insider reports, â€œAustralia-based mining titan BHP Group is the latest player to redirect the majority of its shipments from Asia to Europe, avoiding the Red Sea route. This move came right after similar effortsâ€¦
Show more",1,5,8
ReportAcero,@ReportAcero,2024-01-25T18:19:35.000Z,"ReportAcero
@ReportAcero
Â·
Jan 25Aleja BHP Group neviÃ³s de Asia a Europa lejos del Mar Rojo",,,
The Times Of India,@timesofindia,2024-01-25T14:40:00.000Z,"The Times Of India
@timesofindia
Â·
Jan 25BHP Group diverts shipments from Asia to Europe amid Red Sea trade disruptions",,3,17
Tracy (ğ’ğ’½ğ’¾ ),@chigrl,2024-01-25T11:04:05.000Z,"Tracy (ğ’ğ’½ğ’¾ )
@chigrl
Â·
Jan 25$BHP Mining giant BHP Group is diverting almost all of its shipments from Asia to Europe away from the Red Sea, according to people familiar with the matter, the latest sign of how Houthi attacks in the region have upended global trade.",2,5,37
drdivine,@drdivine,2024-01-25T10:29:29.000Z,"drdivine
@drdivine
Â·
Jan 25Live Update: Australian BHP Group says almost all its ships diverted from Red Sea https://timesofisrael.com/liveblog_entry/australian-bhp-group-says-almost-all-its-ships-diverted-from-red-sea/â€¦ via 
@timesofisrael",,,
reuben poupko,@poupko,2024-01-25T09:41:29.000Z,"reuben poupko
@poupko
Â·
Jan 25Live Update: Australian BHP Group says almost all its ships diverted from Red Sea https://timesofisrael.com/liveblog_entry/australian-bhp-group-says-almost-all-its-ships-diverted-from-red-sea/â€¦ via 
@timesofisrael",,1,
ToI ALERTS,@TOIAlerts,2024-01-25T09:31:37.000Z,"ToI ALERTS
@TOIAlerts
Â·
Jan 25Live update: Australian BHP Group says almost all its ships diverted from Red Sea",1,10,11
Talha Bhatti,@talhathebhatti,2024-01-25T08:46:51.000Z,"Talha Bhatti
@talhathebhatti
Â·
Jan 25Replying to 
@spectatorindex",,,
The Jerusalem Post,@Jerusalem_Post,2024-01-25T08:45:18.000Z,"The Jerusalem Post
@Jerusalem_Post
Â·
Jan 25Australian mining giant BHP Group http://BHP.AX is diverting almost all of its shipments from Asia to Europe away from the Red Sea, the Wall Street Journal reported on Thursday.",6,10,13
Shehan R,@ShehanR2,2024-01-25T08:36:52.000Z,"Shehan R
@ShehanR2
Â·
Jan 25Mining giant BHP Group is diverting almost all of its shipments from Asia to Europe away from the Red Sea, according to WSJ sources.

The decision follows similar moves by companies including Shell, BP and Qatar Energy.",,,2
AInvest Wire,@Ainvest_Wire,2024-01-25T08:24:44.000Z,"AInvest Wire
@Ainvest_Wire
Â·
Jan 25BHP Group suspends shipping via Red Sea - WSJ
#AInvest #Ainvest_Wire #world #precious #strategy
View more:",,,
ZoomStocks Markets,@ZSMarkets,2024-01-25T07:22:06.000Z,"ZoomStocks Markets
@ZSMarkets
Â·
Jan 25#Australia: Stocks on the move today

âœ¦Investment companies gains as #GQGPartners revises earnings estimate

#Netwealth Group â–²1.5%, #Perpetual â–²0.2%

âœ¦Mining stocks lead the gains amongst sectors

#BHPGroup â–²1.5%, #RioTinto â–²2.8%
Show more",1,1,
TimBukOne,@TimBukOne,2024-01-25T06:05:20.000Z,"TimBukOne
@TimBukOne
Â·
Jan 25#JSE Trading Stats - 24/01/2024 - #RMB #Naspers #BHPGroup #RedefineProperties #Prosus #AnheuserBusch",,2,3
Sharetrackin Media,@SharetrackinM,2024-01-24T07:58:08.000Z,"Sharetrackin Media
@SharetrackinM
Â·
Jan 24With an amazing performance from BHP Group Limited, 
we will pop the champagne and toss the confetti with all the investors who had the wisdom to invest. 

Snap the link and book your first one-on-one session to see how you can celebrate with us. 
https://go.oncehub.com/GeorgeST",1,,
PenkeTrading.com,@PenkeTrading,2024-01-23T09:58:23.000Z,"PenkeTrading.com
@PenkeTrading
Â·
Jan 23I found you an Oversold RSI (Relative Strength Index) on the daily chart of BHP Group Limited. Is that #bullish or #bearish?

 $bhp #bhp #rsi #oversold #nyse

https://penketrading.com/symbols/BHP.NYSE/â€¦",,,
TimBukOne,@TimBukOne,2024-01-23T06:01:18.000Z,"TimBukOne
@TimBukOne
Â·
Jan 23#JSE Trading Stats - 22/01/2024 - #RedefineProperties #Naspers #BHPGroup #RMB #Firstrand #AnheuserBusch",,,
buysellsignals,@selltipsdotcom,2024-01-22T14:54:50.000Z,"buysellsignals
@selltipsdotcom
Â·
Jan 22BHP Group (BHP: GBX2,346.50) drops to three-month low; -GBX13.50 [-0.6%]",,,
buysellsignals,@selltipsdotcom,2024-01-22T13:38:00.000Z,"buysellsignals
@selltipsdotcom
Â·
Jan 22BHP Group (BHP: GBX2,354.50) in 6th consecutive fall; -GBX5.50 [-0.2%]",,,
StockWatchWeekly,@SWatchWeeklyCom,2024-01-22T05:00:09.000Z,"StockWatchWeekly
@SWatchWeeklyCom
Â·
Jan 22 BHP Group Ltd (ASX:BHP) share price has risen since the start of 2024. Find out more about the latest stock market trends. #StocksToWatch #StockMarket",,,
megadesirestuff,@megadesirestuff,2024-01-21T04:51:04.000Z,"megadesirestuff
@megadesirestuff
Â·
Jan 21Breaking News Alert! The world's largest diamond mining company, BHP Group Ltd., has announced plans to sell its stakes in two Australian coal mines due to climate change concerns. The move comes just weeks before the UN Climate Change Conference (COP27)",,,
TimBukOne,@TimBukOne,2024-01-20T06:00:37.000Z,"TimBukOne
@TimBukOne
Â·
Jan 20#JSE Trading Stats - 19/01/2024 - #Firstrand #BHPGroup #RedefineProperties #Naspers #AnheuserBuschInBev",1,,
TimBukOne Candlesticks,@TimBukOneCandle,2024-01-19T22:07:36.000Z,"TimBukOne Candlesticks
@TimBukOneCandle
Â·
Jan 19#BHPGroup $JSEBHG - Search: http://dlvr.it/T1cjlH",,,
CentralCharts EN,@CentralChartsEN,2024-01-19T20:35:26.000Z,"CentralCharts EN
@CentralChartsEN
Â·
Jan 19 $BHP #BHPGROUP - 1H: With a strongly bearish trend, the price of BHP GROUP LTD. is trying to inflate a little while more or less stagnating in the short term. Is... 
@Londinia_IA",,,
Londinia IA,@Londinia_IA,2024-01-19T20:35:26.000Z,"Londinia IA
@Londinia_IA
Â·
Jan 19 $BHP #BHPGROUP - 1H: With a strongly bearish trend, the price of BHP GROUP LTD. is trying to inflate a little while more or less stagnating in the short term. Is the price...",,,
UniversidadxClima,@UniversidadxC,2024-01-19T13:35:29.000Z,"UniversidadxClima
@UniversidadxC
Â·
Jan 19Replying to 
@UniversidadxC",1,1,
ChemAnalyst,@Chemanalysts,2024-01-19T09:27:03.000Z,"ChemAnalyst
@Chemanalysts
Â·
Jan 19The #Australian nickel industry is currently navigating a complex landscape shaped by increased competition from #Indonesia and evolving battery technologies. http://tinyurl.com/mr2chnuf
@bhp
 

#BHPGroup #batterytechnologies #nickelindustry",,,
TimBukOne,@TimBukOne,2024-01-19T06:03:40.000Z,"TimBukOne
@TimBukOne
Â·
Jan 19#JSE Trading Stats - 18/01/2024 - #Firstrand #Richemont #BHPGroup #SibanyeStillwater #AnheuserBuschInBev",,,
Nick Rossetto,@nrossett,2024-01-19T04:43:52.000Z,"Nick Rossetto
@nrossett
Â·
Jan 19$BHP Group red    #ASX",1,,2
InterCooler,@intercooleronli,2024-01-19T03:50:23.000Z,"InterCooler
@intercooleronli
Â·
Jan 19Critical Analysis: Lithium Americas $Argentina $LAAC vs. BHP Group $BHP",,,
Investment Bites,@InvestmentBites,2024-01-18T07:01:00.000Z,"Investment Bites
@InvestmentBites
Â·
Jan 1826 UK companies with earnings or trading updates 
Thurs 18th Jan

The Works - $WRKS.L
Sage Group - $SGE.L
Hotel Chocolate - $HOTC.L
Flutter Ent - $FLTR.L
Dr. martens - $DOCS.L
Dunelm - $DNLM.L
Currys Plc - $CURY.L
Boohoo - 
Show more",1,,2
TimBukOne SENS,@TimBukOneSENS,2024-01-18T06:22:05.000Z,"TimBukOne SENS
@TimBukOneSENS
Â·
Jan 18#BHPGroup $JSEBHG - SENS PDF: http://dlvr.it/T1XMZ9",,,
TimBukOne Charts,@TimBukOneCharts,2024-01-18T06:21:06.000Z,"TimBukOne Charts
@TimBukOneCharts
Â·
Jan 18#BHPGroup $JSEBHG has issued a market related announcement: http://dlvr.it/T1XMQl",,,
TimBukOne,@TimBukOne,2024-01-18T06:04:20.000Z,"TimBukOne
@TimBukOne
Â·
Jan 18#JSE Trading Stats - 17/01/2024 - #SACorporateRealEstate #Naspers #BHPGroup #RedefineProperties #Firstrand #AnheuserBuschInBev",,,
Stockhead,@StockheadAU,2024-01-18T05:24:24.000Z,"Stockhead
@StockheadAU
Â·
Jan 18 ASX falls further; rate cut bets slashed
 APM Human Services down 40pc, Liontown 10pc
 BHP Group down after disappointing production guidance",,,
CommSec,@CommSec,2024-01-18T02:48:45.000Z,"CommSec
@CommSec
Â·
Jan 18Heavyweight miners led declines on the ASX 200 index, dropping as much as 1.8% to their lowest level since November 14. BHP Group $BHP fell as much as 2.2%, their biggest daily drop in more than two months after posting a 2.2% drop in second-quarter iron ore production.",,1,
Resource Recap,@ResourceRecap,2024-01-18T00:45:55.000Z,"Resource Recap
@ResourceRecap
Â·
Jan 18Replying to 
@ResourceRecap",1,,
CommSec,@CommSec,2024-01-18T00:23:52.000Z,"CommSec
@CommSec
Â·
Jan 18Australian mining stocks fall as much as 1.8% to hit their lowest level since November 14, 2023 on weak iron ore prices. BHP Group $BHP falls as much as 2.2% to hit their lowest level since November 13, 2023 after reporting a 2.2% drop in second-quarter iron ore production.",1,1,3
Jake P. Noch,@Jake_P_Noch,2024-01-18T00:08:13.000Z,"Jake P. Noch
@Jake_P_Noch
Â·
Jan 18
AutomatedBHP Group backs FY24 copper production view of 1.72-1.91Mt https://blog.tipranks.com/bhp-group-backs-fy24-copper-production-view-of-1-72-1-91mt/?utm_source=dlvr.it&utm_medium=twitterâ€¦",,,
Jake P. Noch,@Jake_P_Noch,2024-01-18T00:08:11.000Z,"Jake P. Noch
@Jake_P_Noch
Â·
Jan 18
AutomatedBHP Group reports Q2 copper output at 437.4kt, up 3% from last year https://blog.tipranks.com/bhp-group-reports-q2-copper-output-at-437-4kt-up-3-from-last-year/?utm_source=dlvr.it&utm_medium=twitterâ€¦",,,
CommSec,@CommSec,2024-01-17T23:15:12.000Z,"CommSec
@CommSec
Â·
Jan 18BHP Group $BHP said on Thursday it was reassessing the value of its nickel operations after a price slump, in a move that could lead to write-downs amid an oversupply of the metal used in electric vehicle batteries.",,,
CommSec,@CommSec,2024-01-17T21:44:37.000Z,"CommSec
@CommSec
Â·
Jan 17BHP Group $BHP on Thursday reported a 2.2% drop in second quarter iron ore production due to impact of the ongoing ramp up of the Central Pilbara hub.",,2,1
CommSec,@CommSec,2024-01-17T21:37:13.000Z,"CommSec
@CommSec
Â·
Jan 17BHP Group $BHP reaffirmed its attributable iron ore production forecast for the full year on Thursday. Still sees attributable iron ore production 254m to 264.5m tons, estimate 257.59m over the year. Sees metallurgical coal production 23m to 25m tons, saw 28 million to 31m.",,1,1
buysellsignals,@selltipsdotcom,2024-01-17T14:22:58.000Z,"buysellsignals
@selltipsdotcom
Â·
Jan 17BHP Group (BHP: GBX2,384.0) keeps sliding; -GBX43.50 [-1.8%]",,,
Usa Jaun News,@UsaJaunNews,2024-01-17T02:17:26.000Z,"Usa Jaun News
@UsaJaunNews
Â·
Jan 17Australia's nickel producers reel from supply glut By Reuters 

Â© Reuters. FILE PHOTO: A ton of nick... Â© Reuters. FILE PHOTO: A ton of nickel powder made by BHP Group sits in a warehouse at its Nickel West division, south of Perth, Australia August 2...",,,
Usa Jaun News,@UsaJaunNews,2024-01-17T01:57:25.000Z,"Usa Jaun News
@UsaJaunNews
Â·
Jan 17BHP faces nickel choice this year as high-cost Australian miners suffer By Reuters 

2/2

Â© Reuters. FILE PHOTO: A view of... 2/2 Â© Reuters. FILE PHOTO: A view of a new nickel sulphate plant that global miner BHP Group is building to service the batte...",,,
buysellsignals,@selltipsdotcom,2024-01-16T14:41:26.000Z,"buysellsignals
@selltipsdotcom
Â·
Jan 16BHP Group (BHP: GBX2,453.0) drops to two-month low on spectacular volume; -GBX2 [-0.1%] Vol Index 9.1 [1 is avg]",,,
CNBC-TV18,@CNBCTV18News,2024-01-16T11:17:40.000Z,"CNBC-TV18
@CNBCTV18News
Â·
Jan 16COMING UP AT #Davos2024 | THE ECONOMICS OF GENDER PARITY

Catch 
@ShereenBhan
 speak with Gabriela Sommerfeld, Min of Foreign Affairs & Human Mobility of Ecuador, Annette Mosman of APG Asset Management, Mike Henry of BHP Group & Mulyani Indrawati, Ministry of Finance of Indonesiaâ€¦
Show more",,,1
FSMOne Malaysia,@FSMOne_my,2024-01-16T06:20:18.000Z,"FSMOne Malaysia
@FSMOne_my
Â·
Jan 16Replying to 
@FSMOne_my",1,,
TimBukOne,@TimBukOne,2024-01-16T06:05:18.000Z,"TimBukOne
@TimBukOne
Â·
Jan 16#JSE Trading Stats - 15/01/2024 - #RMBHoldings #Firstrand #BHPGroup #Naspers #AnheuserBuschInBev",1,1,
ZoomStocks Markets,@ZSMarkets,2024-01-16T04:44:59.000Z,"ZoomStocks Markets
@ZSMarkets
Â·
Jan 16Replying to 
@ZSMarkets",1,,
Olivia Axel,@axel_kc,2024-01-15T18:05:46.000Z,"Olivia Axel
@axel_kc
Â·
Jan 15Replying to 
@ZSMarkets",,,
Mining Digital,@MiningDig,2024-01-15T17:37:27.000Z,"Mining Digital
@MiningDig
Â·
Jan 15https://bit.ly/3Skyxuv

â€œThe magnitude of the global warming challenge is significant and change is coming fast. But with that comes great opportunity for the mining industry,â€ believes Mike Henry, BHP Group CEO. 

Read the full article here! 

#Mining #Sustainability #Strategy",,,1
buysellsignals,@selltipsdotcom,2024-01-15T14:14:29.000Z,"buysellsignals
@selltipsdotcom
Â·
Jan 15BHP Group (BHP: GBX2,450.0) drops to two-month low; -GBX35 [-1.4%]",,,
CommSec,@CommSec,2024-01-15T01:17:16.000Z,"CommSec
@CommSec
Â·
Jan 15Mining stocks dropped as much as 0.9% to hit their lowest level in a month. Iron ore futures slipped last week. BHP Group $BHP and Rio Tinto $RIO were down 1% and 0.8%, respectively.",1,1,2
TimBukOne,@TimBukOne,2024-01-13T06:02:12.000Z,"TimBukOne
@TimBukOne
Â·
Jan 13#JSE Trading Stats - 12/01/2024 - #Firstrand #BHPGroup #SibanyeStillwater #Richemont #AnheuserBuschInBev",3,,
Geert Van Calster,@GAVClaw,2024-01-12T15:44:11.000Z,"Geert Van Calster
@GAVClaw
Â·
Jan 12Claim re-amendment allowed in Brazilian dam case re issues of polluter pays, risks and liability issues under BRA law 

Municipio De Mariana & Ors v BHP Group (UK) Ltd & Anor [2024] EWHC 23 (TCC)
https://bailii.org/ew/cases/EWHC/TCC/2024/23.htmlâ€¦",1,,3
MoPh Markets,@MoPhMarkets,2024-01-12T10:38:40.000Z,"MoPh Markets
@MoPhMarkets
Â·
Jan 12#CWR Ceres Power cut to UP from SP at RBC Capital 

#BNZL Bunzl lifted to EW from UW at Morgan Stanley 

 $RIO #RIO Rio Tinto initiated with Buy at Goldman Sachs 

 $BHP Group initiated with Neutral at Goldman Sachs",1,,2
TimBukOne,@TimBukOne,2024-01-11T06:01:12.000Z,"TimBukOne
@TimBukOne
Â·
Jan 11#JSE Trading Stats - 10/01/2024 - #Firstrand #BHPGroup #GrowthpointProperties #Naspers #AnheuserBuschInBev",,1,1
Dividend Talks on YouTube,@DividendTalks,2024-01-10T22:48:32.000Z,"Dividend Talks on YouTube
@DividendTalks
Â·
Jan 10Replying to 
@DividendTalks",2,,15
NAI500,@NAI500,2024-01-10T19:30:13.000Z,"NAI500
@NAI500
Â·
Jan 10[çŸ¿ä¸šè‚¡ç¥¨èƒ½ä¸èƒ½èµ·æ¥ï¼Œä¸­å›½çš„åˆºæ¿€æ”¿ç­–æœ€å…³é”®]

Anglo American plc ADR $NGLOY
Teck Resources Ltd $TECK.B
Rio Tinto Group $RIO
BHP Group $BHP

æ·±å…¥äº†è§£ï¼šhttps://ow.ly/acz950QpEsz

#china #copper #interestrate",,,
buysellsignals,@selltipsdotcom,2024-01-10T14:06:01.000Z,"buysellsignals
@selltipsdotcom
Â·
Jan 10BHP Group (BHP: GBX2,500.50) keeps sliding; -GBX42.50 [-1.7%] Vol Index 1.1 [1 is avg]",,,
buysellsignals,@selltipsdotcom,2024-01-10T13:53:02.000Z,"buysellsignals
@selltipsdotcom
Â·
Jan 10BHP Group (BHP: GBX2,499.50) accelerates decline; -GBX43.50 [-1.7%] Vol Index 1.9 [1 is avg]",,,
BROKSTOCK,@brokstock,2024-01-10T11:34:57.000Z,"BROKSTOCK
@brokstock
Â·
Jan 10TOP 5 JSE Winners and Losers  

WINNERS
Woolies 1.68%
Anglo 1.49%
Gfields 1.38%
Exxaro 1.14%
Abinbev 1.11%

LOSERS
Sasol -5.70%
Kumbaio -2.36%
Implats -1.80%
Mondiplpc -1.74%
Show more",,2,4
TimBukOne,@TimBukOne,2024-01-10T06:01:12.000Z,"TimBukOne
@TimBukOne
Â·
Jan 10#JSE Trading Stats - 09/01/2024 - #SACorporateRealEstate #Naspers #BHPGroup #RedefineProperties #PROSUS #AnheuserBuschInBev",,,
JamesDruryPartners,@JDruryPartners,2024-01-10T05:17:03.000Z,"JamesDruryPartners
@JDruryPartners
Â·
Jan 10SSR Mining adds   Daniel Malchuk (Fmr President-Operations, BHP Group) to Board $SSRM #corpgov https://sec.gov/ix?doc=/Archives/edgar/data/921638/000092163824000029/ssrm-20240108.htmâ€¦",,,2
buysellsignals,@selltipsdotcom,2024-01-10T02:11:23.000Z,"buysellsignals
@selltipsdotcom
Â·
Jan 10BHP Group (BHP: GBX2,543.0) drops to one-month low on strong volume; -GBX30.50 [-1.2%] Vol Index 2.6 [1 is avg]",,,
buysellsignals,@selltipsdotcom,2024-01-09T13:31:26.000Z,"buysellsignals
@selltipsdotcom
Â·
Jan 9BHP Group (BHP: GBX2,546.03) keeps sliding; -GBX27.47 [-1.1%] Vol Index 1.4 [1 is avg]",,,
ZoomStocks Markets,@ZSMarkets,2024-01-09T07:01:40.000Z,"ZoomStocks Markets
@ZSMarkets
Â·
Jan 9#Australia: Stocks on the move today

âœ¦Mining stocks rise after#CapricornMetals give production upgrade

#BHP Group â–²0.6%, #RioTinto â–²0.3%

âœ¦IT stocks lead the gains for the 

#WisetechGlobal â–²2.1%, #Rea Group â–²2.2%
Show more",1,1,
TimBukOne,@TimBukOne,2024-01-09T06:01:13.000Z,"TimBukOne
@TimBukOne
Â·
Jan 9#JSE Trading Stats - 08/01/2024 - #RMBHoldings #Naspers #BHPGroup #Firstrand #AnheuserBuschInBev",,1,
CommSec,@CommSec,2024-01-09T01:49:17.000Z,"CommSec
@CommSec
Â·
Jan 9Australian mining stocks rise as much as 1.4%, even after iron ore futures fell for three consecutive days. Mining giants BHP Group $BHP, Rio Tinto $RIO and Fortescue $FMG climb as much as 1.3%, 1.1% and 2%, respectively.",1,1,8
CommSec,@CommSec,2024-01-09T01:02:52.000Z,"CommSec
@CommSec
Â·
Jan 9Mining stocks jumped 1.2% and were on track for their best session since December 27, 2023. BHP Group $BHP and Rio Tinto $RIO gained 1.1% and 0.8%, respectively. Gold stocks rose 0.7%, with Northern Star Resources $NST up 0.9%.",,,
CentralCharts NL,@CentralchartsNL,2024-01-08T19:26:24.000Z,"CentralCharts NL
@CentralchartsNL
Â·
Jan 8 $BHP #BHPGROUP - Dagelijks: Neemt de basis bullish trend in kracht af? De korte termijn geeft nog geen duidelijke informatie waardoor we zouden kunnen anticiperen op... 
@Athenia_IA",,,
Athenia IA,@Athenia_IA,2024-01-08T19:26:24.000Z,"Athenia IA
@Athenia_IA
Â·
Jan 8 $BHP #BHPGROUP - Dagelijks: Neemt de basis bullish trend in kracht af? De korte termijn geeft nog geen duidelijke informatie waardoor we zouden kunnen anticiperen op een herstel...",,,
Rohit Kumar,@rohitkumar9815,2024-01-06T11:52:01.000Z,"Rohit Kumar
@rohitkumar9815
Â·
Jan 6Biggest Company Of Saudi Arabia
  - Saudi Aramco : $2.1 Tn
Biggest Company Of Australia
  - BHP Group : $148 Bn
Biggest Company Of Indonesia
  - Bank Central Asia : $70 Bn
Biggest Company Of Singapore 
  - DBS Group : $62 Bn
Biggest Company Of New Zealand
  - Xero : $10 Bn",,,4
TimBukOne,@TimBukOne,2024-01-06T06:04:11.000Z,"TimBukOne
@TimBukOne
Â·
Jan 6#JSE Trading Stats - 05/01/2024 - #RedefineProperties #Naspers #BHPGroup #Firstrand #AnheuserBuschInBev",,,
buysellsignals,@selltipsdotcom,2024-01-05T14:07:37.000Z,"buysellsignals
@selltipsdotcom
Â·
Jan 5BHP Group (BHP: GBX2,568.0) drops to 21-day low on robust volume; -GBX58.50 [-2.2%] Vol Index 1.5 [1 is avg]",,,
buysellsignals,@selltipsdotcom,2024-01-05T13:15:54.000Z,"buysellsignals
@selltipsdotcom
Â·
Jan 5BHP Group (BHP: GBX2,572.50) keeps sliding; -GBX54 [-2.1%] Vol Index 1.3 [1 is avg]",,,
TimBukOne,@TimBukOne,2024-01-05T06:03:36.000Z,"TimBukOne
@TimBukOne
Â·
Jan 5#JSE Trading Stats - 04/01/2024 - #Firstrand #Naspers #BHPGroup #OldMutual #PROSUS #AnheuserBuschInBev",,,1
buysellsignals,@selltipsdotcom,2024-01-04T14:46:00.000Z,"buysellsignals
@selltipsdotcom
Â·
Jan 4BHP Group (BHP: GBX2,624.0) down 2.8% in 2 days; -GBX22 [-0.8%]",,,
TimBukOne,@TimBukOne,2024-01-04T06:03:37.000Z,"TimBukOne
@TimBukOne
Â·
Jan 4#JSE Trading Stats - 03/01/2024 - #Firstrand #Naspers #BHPGroup #SYNERGYB #AnheuserBuschInBev",,,
Kamal Mustafa âœª,@MeKamalMustafa,2024-01-03T13:57:39.000Z,"Kamal Mustafa âœª
@MeKamalMustafa
Â·
Jan 3Analyst Report: BHP Group Limited",,,
Jake P. Noch,@Jake_P_Noch,2024-01-03T13:13:28.000Z,"Jake P. Noch
@Jake_P_Noch
Â·
Jan 3
AutomatedAnalyst Report: BHP Group Limited https://finance.yahoo.com/research/reports/ARGUS_3655_AnalystReport_1704283209000?yptr=yahoo&ncid=yahooproperties_plusresear_nm5q6ze1cei&utm_source=dlvr.it&utm_medium=twitterâ€¦",,,
"Music Licensing, Inc. (OTC: SONG)",@OTC_SONG,2024-01-03T12:57:35.000Z,"Music Licensing, Inc. (OTC: SONG)
@OTC_SONG
Â·
Jan 3
Automated$TSLA  $SPY $SONG  Analyst Report: BHP Group Limited https://finance.yahoo.com/research/reports/ARGUS_3655_AnalystReport_1704283209000?yptr=yahoo&ncid=yahooproperties_plusresear_nm5q6ze1cei&utm_source=dlvr.it&utm_medium=twitterâ€¦ $QQQ $AAPL $BTC",,,
TimBukOne,@TimBukOne,2024-01-03T06:03:36.000Z,"TimBukOne
@TimBukOne
Â·
Jan 3#JSE Trading Stats - 02/01/2024 - #RMBHoldings #Naspers #BHPGroup #Firstrand #AnheuserBuschInBev",,,
Manuel Palkowitsch,@mpalkowitsch,2024-01-02T23:48:08.000Z,"Manuel Palkowitsch
@mpalkowitsch
Â·
Jan 3Replying to 
@xid_id15473
 and 
@JustDayDrinking",,,2
Amine,@AmineTX,2024-01-02T19:40:34.000Z,"Amine
@AmineTX
Â·
Jan 2Decoding BHP Group's Options Activity: What's the Big Picture? - BHP Group  ( NYSE:BHP )  - Source: Benzinga.
https://benzinga.com/markets/options/24/01/36456343/decoding-bhp-groups-options-activity-whats-the-big-picture#StockMarketâ€¦ #StockMarket",,,
X-Files Market Investigators,@market_x_files,2024-01-02T15:55:16.000Z,"X-Files Market Investigators
@market_x_files
Â·
Jan 2BHP Group Limited $BHP had an unusualy high put volume of 6K this is 361% of the 30d avg put volume of 1.7K",,,
TimBukOne,@TimBukOne,2023-12-29T07:43:09.000Z,"TimBukOne
@TimBukOne
Â·
Dec 29, 2023#JSE shares that closed at a 12-month high or low on 28/12/2023 - #OmniaHoldings #PBTGroup #SPURCorporation #BHPGroup #CapitecBank #SiriusRealEstate #Quilter #Hammerson #Reinet #AspenPharmacare #PPC #Investec #4SightHoldings #Attacq #Mondi #CAPCO",,,1
TimBukOne,@TimBukOne,2023-12-29T07:43:06.000Z,"TimBukOne
@TimBukOne
Â·
Dec 29, 2023Summary of #JSE shares that closed at a 12-month high or low during the week up to 28/12/2023 - #OmniaHoldings #PBTGroup #LighthouseCapital #BalwinProperties #BHPGroup #GaiaInfrastructure #CASALES #AspenPharmacare #PPC #PSGKonsult #Shoprite #ShopriteHoldings #Investec #Quilter",,,1
TimBukOne,@TimBukOne,2023-12-29T06:02:12.000Z,"TimBukOne
@TimBukOne
Â·
Dec 29, 2023#JSE Trading Stats - 28/12/2023 - #Firstrand #Naspers #BHPGroup #SACorporateRealEstate #AnheuserBuschInBev",,,
Kwhen Finance,@kwhenfinance,2023-12-28T22:45:27.000Z,"Kwhen Finance
@kwhenfinance
Â·
Dec 28, 2023BHP Group Limited - ADR Shares Close in on 52-Week High - Market Mover https://ayr.app/l/rgiv $BHP #stockmarket #kwhenfinance",,,
Seeking Alpha,@SeekingAlpha,2023-12-28T21:35:28.000Z,"Seeking Alpha
@SeekingAlpha
Â·
Dec 28, 2023$BHP $BHPLF - BHP Group: Better Commodity Outlook But Still Pricey. https://seekingalpha.com/article/4660223-bhp-group-better-commodity-outlook-but-still-pricey?source=feed_f&utm_campaign=twitter_automated&utm_content=article&utm_medium=social&utm_source=twitter_automatedâ€¦ #stocks #investing #business",,,
CentralCharts ES,@CentralChartsES,2023-12-28T19:06:08.000Z,"CentralCharts ES
@CentralChartsES
Â·
Dec 28, 2023 $BHP #BHPGROUP - 1H: La tendencia alcista es actualmente muy fuerte en BHP GROUP LTD.. Mientras el precio se mantenga por encima del soporte en , se podrÃ­a... 
@Madritia_IA",,,
Madritia,@Madritia_IA,2023-12-28T19:06:07.000Z,"Madritia
@Madritia_IA
Â·
Dec 28, 2023 $BHP #BHPGROUP - 1H: La tendencia alcista es actualmente muy fuerte en BHP GROUP LTD.. Mientras el precio se mantenga por encima del soporte en , se podrÃ­a intentar...",,,
CentralCharts NL,@CentralchartsNL,2023-12-28T17:26:24.000Z,"CentralCharts NL
@CentralchartsNL
Â·
Dec 28, 2023 $BHP #BHPGROUP - Dagelijks: De bullish trend is momenteel erg sterk op BHP GROUP LTD.. Zolang de koers ruim boven de steun op  blijft, kun je proberen te profiteren van... 
@Athenia_IA",,,
Athenia IA,@Athenia_IA,2023-12-28T17:26:24.000Z,"Athenia IA
@Athenia_IA
Â·
Dec 28, 2023 $BHP #BHPGROUP - Dagelijks: De bullish trend is momenteel erg sterk op BHP GROUP LTD.. Zolang de koers ruim boven de steun op  blijft, kun je proberen te profiteren van de...",,,
Hugo Stolfi,@HStolfi,2023-12-28T17:00:15.000Z,"Hugo Stolfi
@HStolfi
Â·
Dec 28, 2023Replying to 
@HStolfi",,,
ogeltdm,@ogeltdm,2023-12-28T15:59:35.000Z,"ogeltdm
@ogeltdm
Â·
Dec 28, 2023Municipio de Mariana and Ors v BHP Group UK Ltd and Anor 2023 EWHC 3281 TCC - 21 December 2023",,1,2
BROKSTOCK,@brokstock,2023-12-28T14:20:34.000Z,"BROKSTOCK
@brokstock
Â·
Dec 28, 2023TOP 5 JSE Winners and Losers
  
WINNERS
Naspersn 1.40%
Prosus 1.05%
Capitec 1.02%
Aspen 0.97%
Bhpgroup 0.83%

LOSERS
Implats -3.17%
Angloplat -3.10%
Cfields -2.24%
Kumbaio -1.95%
Sibanye-S -1.72%
Show more",1,,1
TimBukOne,@TimBukOne,2023-12-28T07:42:10.000Z,"TimBukOne
@TimBukOne
Â·
Dec 28, 2023#JSE shares that closed at a 12-month high or low on 27/12/2023 - #OmniaHoldings #GaiaInfrastructure #HarmonyGoldMining #BalwinProperties #FortressReit #AspenPharmacare #Investec #SiriusRealEstate #CASALES #BHPGroup #Quilter #CAPCO #StandardBank #Reinet #NepiRockcastle",,,
TimBukOne,@TimBukOne,2023-12-27T07:42:12.000Z,"TimBukOne
@TimBukOne
Â·
Dec 27, 2023#JSE shares that closed at a 12-month high or low on 22/12/2023 - #OmniaHoldings #Naspers #Investec #PROSUS #StandardBank #AYOTech #Reinet #PBTGroup #CAPCO #AdcockIngram #SiriusRealEstate #FortressReit #BHPGroup #NepiRockcastle #CapitalRegional #LighthouseCapital",,,
TimBukOne,@TimBukOne,2023-12-27T06:00:38.000Z,"TimBukOne
@TimBukOne
Â·
Dec 27, 2023#JSE Trading Stats - 22/12/2023 - #OrionMinerals #Naspers #BHPGroup #RedefineProperties #PROSUS #AnheuserBuschInBev",,,
Kwhen Finance,@kwhenfinance,2023-12-26T22:47:59.000Z,"Kwhen Finance
@kwhenfinance
Â·
Dec 26, 2023BHP Group Limited - ADR Shares Climb 0.1% Past Previous 52-Week High - Market Mover https://ayr.app/l/D13P $BHP #stockmarket #kwhenfinance",,,
TimBukOne,@TimBukOne,2023-12-26T07:41:08.000Z,"TimBukOne
@TimBukOne
Â·
Dec 26, 2023#JSE shares that closed at a 12-month high or low on 22/12/2023 - #AdcockIngram #Naspers #Investec #PROSUS #OmniaHoldings #AYOTech #Reinet #PBTGroup #LighthouseCapital #FortressReit #SiriusRealEstate #CapitalRegional #BHPGroup #CAPCO #NepiRockcastle #StandardBank",,,1
TimBukOne,@TimBukOne,2023-12-26T06:00:38.000Z,"TimBukOne
@TimBukOne
Â·
Dec 26, 2023#JSE Trading Stats - 22/12/2023 - #OrionMinerals #Naspers #BHPGroup #RedefineProperties #PROSUS #AnheuserBuschInBev",1,,
Schumi,@Schumi40287278,2023-12-25T14:34:54.000Z,"Schumi
@Schumi40287278
Â·
Dec 25, 2023Replying to 
@Schumi40287278",,,
Rohit Kumar,@rohitkumar9815,2023-12-25T10:40:43.000Z,"Rohit Kumar
@rohitkumar9815
Â·
Dec 25, 2023Largest Australian Companies
1) BHP Group : $155 Bn
2) Commonwealth Bank : $112 Bn
3) CSL : $82 Bn
4) National Australia Bank : $56 Bn
5) Fortescue : $50 Bn
6) Westpac Banking : $48 Bn
7) Atlassian : $47 Bn
8) ANZ Bank : $47 Bn
9) Macquarie : $42 Bn
10) Woodside Energy : $40 Bn
Show more",,,2
TimBukOne,@TimBukOne,2023-12-23T07:42:09.000Z,"TimBukOne
@TimBukOne
Â·
Dec 23, 2023#JSE shares that closed at a 12-month high or low on 22/12/2023 - #FortressReit #PROSUS #NepiRockcastle #Naspers #AdcockIngram #PBTGroup #CAPCO #AYOTech #Reinet #SiriusRealEstate #Investec #BHPGroup #CapitalRegional #StandardBank #LighthouseCapital #OmniaHoldings",,,
TimBukOne,@TimBukOne,2023-12-23T06:01:13.000Z,"TimBukOne
@TimBukOne
Â·
Dec 23, 2023#JSE Trading Stats - 22/12/2023 - #OrionMinerals #Naspers #BHPGroup #RedefineProperties #PROSUS #AnheuserBuschInBev",,,
Kwhen Finance,@kwhenfinance,2023-12-22T22:47:00.000Z,"Kwhen Finance
@kwhenfinance
Â·
Dec 22, 2023BHP Group Limited - ADR Shares Close in on 52-Week High - Market Mover https://ayr.app/l/EiG2 $BHP #stockmarket #kwhenfinance",,,
Visible Alpha Insights,@VA_Insights,2023-12-22T15:27:41.000Z,"Visible Alpha Insights
@VA_Insights
Â·
Dec 22, 2023Whitehavenâ€™s Strategic Mine Acquisitions to Boost Coal Revenues

In October 2023, Whitehaven Coal (ASX: $WHC) revealed plans to acquire two coal mines, Blackwater and Daunia, from BHP Group (ASX: $BHP) and Mitsubishi Development in Queensland, Australia. These mines produceâ€¦
Show more",,1,5
Geert Van Calster,@GAVClaw,2023-12-22T09:39:04.000Z,"Geert Van Calster
@GAVClaw
Â·
Dec 22, 2023Unsuccessful application to bounce joinder by calling upon arbitration clause in agreements with co-defendant
For background see https://gavclaw.com/2022/07/11/municipio-de-mariana-v-bhp-questions-on-brussels-ias-lis-pendens-rules-viz-third-states-remain-yet-overall-approach-to-environment-human-rights-suits-against-corporations-in-their-domicile-to-be/â€¦

Municipio de Mariana & Ors v BHP Group (UK) Ltd & Anor [2023] EWHC 3281 (TCC)
https://bailii.org/ew/cases/EWHC/TCC/2023/3281.htmlâ€¦",,,
BROKSTOCK,@brokstock,2023-12-21T09:52:43.000Z,"BROKSTOCK
@brokstock
Â·
Dec 21, 2023This morning's TOP 5 JSE Winners and Losers  

WINNERS
Kumbaio 2.11%
Anglo 1.45%
Bhpgroup 0.86%
Angloplat 0.71%

LOSERS
Capitec -1.80%
Outsure -1.76%
Bidcorp -1.61%
Firstrand -1.43%
Richmont -1.36%
Show more",,,
TimBukOne,@TimBukOne,2023-12-21T06:00:38.000Z,"TimBukOne
@TimBukOne
Â·
Dec 21, 2023#JSE Trading Stats - 20/12/2023 - #Netcare #AngloAmerican #BHPGroup #OrionMinerals #Naspers #AnheuserBuschInBev",,,1
CommSec,@CommSec,2023-12-21T00:59:15.000Z,"CommSec
@CommSec
Â·
Dec 21, 2023Heavyweight miners led the fall, shedding 0.9% in what could be their worst day since December 5, if losses hold. BHP Group $BHP and Fortescue $FMG fell 1.4% and 1.1%, respectively.",,1,1
TimBukOne,@TimBukOne,2023-12-20T06:04:37.000Z,"TimBukOne
@TimBukOne
Â·
Dec 20, 2023#JSE Trading Stats - 19/12/2023 - #SibanyeStillwater #Naspers #BHPGroup #GrowthpointProperties #AngloAmerican #AnheuserBuschInBev",,,
CommSec,@CommSec,2023-12-20T00:11:28.000Z,"CommSec
@CommSec
Â·
Dec 20, 2023Rate-sensitive financials jumped 0.6%, with the ""Big Four"" banks gaining between 0.2% and 0.9%. Mining stocks rose 0.6%, with BHP Group $BHP up 0.7%.",,1,3
Kwhen Finance,@kwhenfinance,2023-12-19T22:44:21.000Z,"Kwhen Finance
@kwhenfinance
Â·
Dec 19, 2023BHP Group Limited - ADR Shares Close in on 52-Week High - Market Mover https://ayr.app/l/e4Ch $BHP #stockmarket #kwhenfinance",,,
Reifenpresse.de,@Reifenpresse,2023-12-19T07:35:35.000Z,"Reifenpresse.de
@Reifenpresse
Â·
Dec 19, 2023OTR-Reifen: Neue Bridgestone-BergbaulÃ¶sung hilft, WertschÃ¶pfung zu steigern -
https://reifenpresse.de/2023/12/19/otr-reifen-neue-bridgestone-bergbauloesung-hilft-wertschoepfung-zu-steigern/â€¦
In Zusammenarbeit mit der BHP Group â€“ einem der grÃ¶ÃŸten Bergbaukonzerne der Welt mit Sitz in Australien â€“ kommt nun erstmals eine als â€innovativâ€œ beschriebene BergbaulÃ¶sung ...",,,
TimBukOne,@TimBukOne,2023-12-19T06:03:37.000Z,"TimBukOne
@TimBukOne
Â·
Dec 19, 2023#JSE Trading Stats - 18/12/2023 - #SibanyeStillwater #Naspers #BHPGroup #Firstrand #AnheuserBuschInBev",,,
BeeBeeAI,@BeeBee_AI23,2023-12-19T04:00:06.000Z,"BeeBeeAI
@BeeBee_AI23
Â·
Dec 19, 2023 Earnings Alert for Dec 19 
 $BHP - BHP Group Limited 
 $ACN - Accenture plc 
 $FDX - FedEx Corporation 
 $SATX - SatixFy Communications Ltd. 
 $FDS - FactSet Research Systems Inc. 
 $CD - Chindata Group Holdings Limited 
 $DZSI - DZS Inc.
 Spotlight on $ACN &â€¦
Show more",,,
Rohit Kumar,@rohitkumar9815,2023-12-18T11:07:35.000Z,"Rohit Kumar
@rohitkumar9815
Â·
Dec 18, 2023Biggest Company Of Saudi Arabia
  - Saudi Aramco : $2.1 Tn
Biggest Company Of Australia
  - BHP Group : $148 Bn
Biggest Company Of Indonesia
  - Bank Central Asia : $70 Bn
Biggest Company Of Singapore 
  - DBS Group : $62 Bn
Biggest Company Of New Zealand
  - Xero : $10 Bn",,,3
BeeBeeAI,@BeeBee_AI23,2023-12-18T02:50:13.000Z,"BeeBeeAI
@BeeBee_AI23
Â·
Dec 18, 2023 Earnings Highlights for the Week 
Keep up with the market: http://BeeBee.AI has all the real-time updates!

 Mon, Dec 18: 
 $HEI (Heico Corporation), 
 $WTER (The Alkaline Water Company Inc.)

 Tue, Dec 19: 
 $BHP (BHP Group Limited), 
 $FDS (FactSetâ€¦
Show more",1,,
CommSec,@CommSec,2023-12-18T00:50:24.000Z,"CommSec
@CommSec
Â·
Dec 18, 2023Sector majors BHP Group $BHP and Rio Tinto $RIO were down 0.2% each. Gold stocks fell 0.8% after two consecutive sessions of gains, with Northern Star Resources $NST and Evolution Mining $EVN down 1.0% and 0.3%, respectively.",1,,
CommSec,@CommSec,2023-12-14T01:14:56.000Z,"CommSec
@CommSec
Â·
Dec 14, 2023Mining stocks led the gains, jumping as much as 2.7% to hit their highest level since Aug. 1. Sector heavyweights BHP Group $BHP was up 1.4%, while Rio Tinto $RIO rose 1.6%.",,1,1
TimBukOne SENS,@TimBukOneSENS,2023-12-13T08:25:10.000Z,"TimBukOne SENS
@TimBukOneSENS
Â·
Dec 13, 2023#BHPGroup $JSEBHG - SENS PDF: http://dlvr.it/T04Lb7",,,
Mark Alfred Clarkson,@MarkAClarkson,2023-12-13T06:11:30.000Z,"Mark Alfred Clarkson
@MarkAClarkson
Â·
Dec 13, 2023https://law360.co.uk/commercial-litigation-uk/articles/1776207â€¦

Brazilian mining business Vale SA urged a London judge on Tuesday to block 
@bhp
 Group's attempt to share its Â£36 billion ($45.2 billion) potential exposure to damages from a collapsed dam, saying the dispute must be resolved in arbitration.",,,
TimBukOne,@TimBukOne,2023-12-13T06:04:12.000Z,"TimBukOne
@TimBukOne
Â·
Dec 13, 2023#JSE Trading Stats - 12/12/2023 - #RedefineProperties #AngloAmerican #BHPGroup #SibanyeStillwater #Naspers #AnheuserBuschInBev",,,
BeeBeeAI,@BeeBee_AI23,2023-12-12T17:55:19.000Z,"BeeBeeAI
@BeeBee_AI23
Â·
Dec 12, 2023 Mark your calendars for Dec 12th's key earnings:

 $BHP - BHP Group
 $JCI - Johnson Controls International
 $SATX - SatixFy Communications
 $CD - Chindata Group
 $EPIX - ESSA Pharma
 $MAMA - Mama's Creations
Stay ahead of the market with real-time updates onâ€¦
Show more",,,3
CentralCharts IT,@CentralChartsIT,2023-12-12T17:00:44.000Z,"CentralCharts IT
@CentralChartsIT
Â·
Dec 12, 2023 $BHP #BHPGROUP - 1H: La tendenza di fondo rialzista si Ã¨ esaurita o manca di vigore? Il breve termine non offre alcuna informazione che permetterebbe di... 
@Romia_IA",,,
Romia,@Romia_IA,2023-12-12T17:00:43.000Z,"Romia
@Romia_IA
Â·
Dec 12, 2023 $BHP #BHPGROUP - 1H: La tendenza di fondo rialzista si Ã¨ esaurita o manca di vigore? Il breve termine non offre alcuna informazione che permetterebbe di anticipare una...",,,
BROKSTOCK,@brokstock,2023-12-12T09:14:48.000Z,"BROKSTOCK
@brokstock
Â·
Dec 12, 2023Good morning, investors!
BROKSTOCK'S daily analysis of TOP 5 JSE Winners & Losers 

WINNERS
Gfields 1.74%
Bhpgroup 1.45%
Clicks 1.44%
Kumbaio 1.27%
Shoprit 1.11%
Show more",,,1
TimBukOne,@TimBukOne,2023-12-12T06:02:37.000Z,"TimBukOne
@TimBukOne
Â·
Dec 12, 2023#JSE Trading Stats - 11/12/2023 - #SibanyeStillwater #AngloAmerican #BHPGroup #RedefineProperties #Naspers #AnheuserBuschInBev",,1,1
John Kontogianis,@KontogianisJohn,2023-12-12T05:16:35.000Z,"John Kontogianis
@KontogianisJohn
Â·
Dec 12, 2023Boycott DIVEST SANCTION Israel : ICL GROUP (ISRAEL CHEMICALS)
Use instead Melbourne based BHP GROUP LTD in Canada for your mineral and fertilizers.",,,
CommSec,@CommSec,2023-12-12T01:18:30.000Z,"CommSec
@CommSec
Â·
Dec 12, 2023Heavyweight miners fell 0.2%, as iron futures fell on easing demand in top consumer China. Sector majors BHP Group $BHP and Rio Tinto $RIO fell 0.4% and 0.5%, respectively. Gold stocks dipped 0.2% on weaker bullion prices. Energy stocks were down 0.5%.",,,
Travis B. Moore,@TravisMooreB,2023-12-11T23:54:30.000Z,"Travis B. Moore
@TravisMooreB
Â·
Dec 12, 2023BHP Group Ltd. (BHP): Dividend Efficiency: 34.23%
Dividend Yield: 8.49%
Stock Price: $24.52
This company is a major global producer of iron ore, copper, nickel, and other metals.",,,
Franklin VelÃ¡squez.,@franklinvz2011,2023-12-11T20:32:56.000Z,"Franklin VelÃ¡squez.
@franklinvz2011
Â·
Dec 11, 2023Replying to 
@minenergybiz",,,2
CommSec,@CommSec,2023-12-11T00:29:06.000Z,"CommSec
@CommSec
Â·
Dec 11, 2023Heavyweight miners followed the downward move, set to snap a three-day rally, falling 0.2%, with sector giant BHP Group $BHP losing 0.1%.",,,
Yogi spoutible app,@YogiSunlight,2023-12-10T20:42:38.000Z,"Yogi spoutible app
@YogiSunlight
Â·
Dec 10, 2023Some of the colonizers stealing Africa, Congo rich minerals 2023
France, US, UK, Israel, Canada, China, Switzerland, Australia,  UAE
Tech: Google, Microsoft, Dell, Apple, Verizon
EVs: All, Tesla
Mining Firms: Glencore, Molybdenum, Vale, BHP Group",,,
Mark Alfred Clarkson,@MarkAClarkson,2023-12-08T21:17:02.000Z,"Mark Alfred Clarkson
@MarkAClarkson
Â·
Dec 8, 2023https://law360.co.uk/commercial-litigation-uk/articles/1774619â€¦

""Brazilian authorities have said settlement talks over a dam that burst in 2015 and triggered the country's worst environmental disaster have been suspended after mining giants BHP Group and Vale SA refused to present a new financial proposal"".",1,1,1
TimBukOne,@TimBukOne,2023-12-08T06:05:16.000Z,"TimBukOne
@TimBukOne
Â·
Dec 8, 2023#JSE Trading Stats - 07/12/2023 - #Growthpoint #GrowthpointProperties #Naspers #BHPGROUP #RedefineProperties #BritishAmericanTobacco #AnheuserBuschInBev",,1,
Law360UK,@Law360UK,2023-12-07T17:25:18.000Z,"Law360UK
@Law360UK
Â·
Dec 7, 2023Replying to 
@Law360UK",1,,
CentralCharts NL,@CentralchartsNL,2023-12-07T17:06:21.000Z,"CentralCharts NL
@CentralchartsNL
Â·
Dec 7, 2023 $BHP #BHPGROUP - 1 uur: Alle elementen zijn duidelijk bullish, het zou voor traders mogelijk zijn om alleen longposities te handelen (op moment van aankoop) op BHP... 
@Athenia_IA",,,
Athenia IA,@Athenia_IA,2023-12-07T17:06:21.000Z,"Athenia IA
@Athenia_IA
Â·
